name,price
Модульный диван Этен 2 Vertical Mint,149 940
Диван Сите-2 Velvet Eclipse,32 990
Диван Мейлон Velvet Olive,47 990
Диван Самми Velvet Grey,34 990
Диван Спейс Velvet Olive,64 990
Диван угловой Эби-1 Velvet Grey,72 990
Диван Дара Velvet Silver,44 990
Диван угловой Беллер Textile Yellow,39 990
Диван Тилар Textile Grafit,29 990
Модульный диван Этен 4 Vertical Grafit,203 920
Диван Бруквиль Velvet Olive,49 990
Диван Леймарк Velvet Navy Blue,49 990
Модульный диван Этен 3 Vertical Mix,140 940
Диван угловой Льери Barhat Ginger,98 990
Кушетка Манс Velvet Olive,32 990
Диван Слипсон Velvet Olive,59 990
Диван угловой Сайле Velvet Emerald,139 990
Диван угловой Стаус Velvet Blue,42 990
Диван Ольен Velvet Beige,64 990
Диван Льери Barhat Mint,79 990
Кушетка Берил Velvet Mustard,35 990
Диван Риен Velvet Olive,49 990
Диван Маркфул Velvet Coral,66 990
Кушетка Мона Velvet Yellow,32 990
Модульный диван Риббл-3 Bucle Grafit,153 970
Диван Порту Мини Textile Coral,26 990
Диван Ольен Velvet Silver,64 990
Модульный диван Brera-6 Velour Olive,171 960
Диван Лилле Velvet Emerald,49 990
Диван Боско-2 Land Milk,39 990
Модульный диван Полан-1 Velvet Ocean,73 970
Диван Лонди Bucle Galaxy,59 990
Кушетка Роби Textile Grey,19 990
Диван угловой Спейс-2 Soft Grey,98 990
Диван Сите-3 Velvet Blue,39 990
Диван угловой Нумо Velvet Latte,47 990
Модульный диван Риббл-4 Bucle Silver,153 970
Модульный диван Нолан-B 4 Soft Milk,146 450
Диван Сваут Velvet Ocean,66 990
Диван Клаймар Velvet Smoke,57 990
Диван угловой Льери Barhat Emerald,98 990
Модульный диван Brera-1 Velour Black,202 950
Диван Эрвин-3 Light,38 990
Диван Мисл Barhat Mint,74 990
Диван Картос Velvet Stone,52 990
Диван Риббл-10 Bucle Silver,83 990
Диван угловой Аллаум Linia Pink,52 990
Диван Дисент Soft Grafit,98 990
Диван Ниса Land Silver,44 990
Модульный диван Нолан-B 5 Soft Grey,198 440
Диван угловой Эби-1 Velvet Olive,72 990
Диван Сите-3 Velvet Smoke,39 990
Диван угловой Эдвин Velvet Blue,69 990
Диван Кейсес Velvet Latte,26 990
Модульный диван Нолан-W 4 Soft Latte,146 450
Диван угловой Беллер Textile Silver,43 990
Модульный диван Полан-4 Velvet Moss,100 960
Диван Эрвин-2 Brown,30 990
Диван угловой Льери Barhat Mint,98 990
Диван угловой Виена Bucle Silver,94 990
Диван Сите-2 Velvet Moss,32 990
Диван Льери Barhat Ginger,79 990
Диван Массе Velvet Silver,59 990
Диван Викс Textile Light,21 990
Диван Спейс Soft Grey,64 990
Диван Кускен Vertiсal Jeans,46 990
Диван Слипсон Мини Linia Lavender,44 990
Диван Маре Мини Velvet Emerald,27 990
Диван Сорен Textile Grafit,59 990
Диван Биани Barhat Smoke,74 990
Диван угловой Аронт Мини Velvet Light,58 990
Диван угловой Льери Мини Velvet Grey,69 990
Модульный диван Brera-6 Velour Smoke,171 960
Диван Пайпел-3 Bucle Blue,54 990
Кушетка Интори Soft Terra,28 990
Диван угловой Нордика мини Velvet Grey,59 990
Модульный диван Нолан-B 1 Soft Grafit,81 980
Диван Порту Мини Textile Brown,26 990
Модульный диван Brera-1 Velour Lilac,202 950
Диван угловой Динс Velvet Silver,59 990
Кушетка Дилси Textile Coral,37 990
Диван Линс Velvet Grey,34 990
Модульный диван Этен 3 Vertical Mix,140 940
Диван Слипсон Velvet Stone,59 990
Модульный диван Brera-3 Bucle Beige,142 970
Диван угловой Биани-1 Barhat Beige,79 990
Модульный диван Этен 5 Vertical Light,77 960
Диван Ниса Land Light,44 990
Диван Мисл Barhat Beige,74 990
Диван Кареро Time Grey,69 990
Диван Риббл-1 Bucle Forest,68 990
Модульный диван Brera-1 Velour Galaxy,202 950
Диван Самми Velvet Emerald,34 990
Диван Мира Velvet Light,43 990
Модульное кресло Полан Velvet Smoke,43 970
Диван угловой Виллес Velvet Terra,56 990
Модульный диван Сэндж 3 Textile Grey,78 960
Диван Марей Soft Gold,89 990
Диван угловой Бруквиль Velvet Olive,59 990
Диван Инес Vertical Terra,39 990
Модульный диван Нолан-W 5 Soft Yellow,198 440
Диван Соланс Velvet Yellow,29 990
Модульный диван Полан-1 Velvet Caramel,75 970
Диван угловой Порту Textile Light,32 990
Модульный диван Brera-4 Velour Cherry,161 970
Диван угловой Мейлон Velvet Beige,49 990
Диван Лачи Velvet Grafit,32 990
Диван угловой Амрано Velvet Terra,39 990
Модульный диван Этен 4 Vertical Silver,203 920
Диван Динс Velvet Honey,54 990
Модульный диван Риббл-2 Bucle Beige,128 980
Диван Кускен Velvet Mint,46 990
Модульный диван Риббл-5 Bucle Beige,194 960
Диван Лесли Velvet Grey,46 990
Модульный диван Этен 3 Vertical Silver,140 940
Диван Милкен Velvet Grey,45 990
Диван Дара Velvet Terra,44 990
Диван Роттердам Cozy Milk,27 990
Диван Соланс Velvet Grey,29 990
Диван угловой Дарол Velvet Beige,64 990
Диван Арклоу Soft Mint,56 990
Модульный диван Риббл-3 Bucle Beige,153 970
Диван угловой Дисент-2 Velvet Beige,109 990
Модульный диван Этен 2 Vertical Light,149 940
Модульный диван Этен 2 Vertical Mix,149 940
Модульный диван Этен Vertical Light,81 960
Модульный диван Этен 1 Vertical Mix,115 950
Диван Байма Velvet Navy Blue,69 990
Диван Лесли Velvet Navy Blue,46 990
Диван Байма Velvet Olive,69 990
Диван угловой Динс Velvet Honey,59 990
Диван Риббл-2 Bucle Beige,68 990
Диван Бонс-Т Velvet Navy Blue,44 990
Диван угловой Динс Velvet Terra,59 990
Диван угловой Дарол Velvet Terra,64 990
Диван Тилар Textile Plum,29 990
Модульный диван Риббл-4 Bucle Beige,153 970
Диван Риббл-10 Bucle Beige,83 990
Диван Соланс Velvet Honey,29 990
Модульный диван Этен 6 Vertical Silver,82 960
Модульный диван Этен 1 Vertical Light,115 950
Диван Соланс Velvet Navy Blue,29 990
Диван угловой Дарол Velvet Stone,64 990
Диван Шилдс Textile Grey,86 990
Диван Кускен Velvet Grey,46 990
Модульный диван Этен 1 Vertical Pink,115 950
Диван Бонс-Т Velvet Beige,44 990
Модульный диван Этен 1 Vertical Silver,115 950
Модульный диван Этен 3 Vertical Mix,140 940
Модульный диван Этен 2 Vertical Silver,149 940
Диван угловой Слипсон Velvet Olive,66 990
Диван Ольен Мини Velvet Honey,54 990
Диван Риббл-11 Bucle Beige,83 990
Диван Байма Velvet Terra,69 990
Диван угловой Слипсон Velvet Honey,66 990
Диван Риббл-7 Bucle Beige,51 990
Диван Винси Velvet Mint,22 990
Диван Данста Velvet Grey,66 990
Диван Леймарк Velvet Emerald,49 990
Модульный диван Этен 5 Vertical Silver,77 960
Диван Дисент Velvet Beige,79 990
Диван Ольен Мини Velvet Mint,54 990
Модульный диван Этен Vertical Beige,81 960
Диван Льери Bucle White,104 990
Кушетка Ринт Cozy Milk,20 990
Диван Бонс-Т Velvet Terra,44 990
Диван Ольен Velvet Olive,64 990
Диван угловой Плэнтис Velvet Mint,98 990
Диван Роттердам-3 Velvet Beige,31 990
Диван Риббл-1 Bucle Beige,68 990
Диван Бэй Grey,29 990
Диван Бэй Grafit,29 990
Модульный диван Брайт-G 1 Textile Cream,64 970
Модульный диван Брайт-G 2 Textile Cream,91 960
Модульный диван Брайт-G 1 Textile Grey,64 970
Модульный диван Брайт-G 2 Textile Grey,91 960
Модульный диван Брайт-B 1 Textile Beige,64 970
Модульный диван Брайт-B 2 Textile Beige,91 960
Модульный диван Брайт-B 2 Textile Yellow,91 960
Модульный диван Брайт-B 1 Textile Yellow,64 970
Модульный диван Брайт-G 5 Textile Cream,173 930
Модульный диван Брайт-G 3 Textile Cream,111 950
Модульный диван Брайт-G 3 Textile Grey,111 950
Модульный диван Брайт-B 3 Textile Beige,111 950
Модульный диван Брайт-B 5 Textile Beige,173 930
Модульный диван Брайт-B 5 Textile Yellow,173 930
Модульный диван Брайт-B 3 Textile Yellow,111 950
Модульный диван Брайт-G 4 Textile Cream,126 950
Модульный диван Брайт-G 4 Textile Grey,126 950
Модульный диван Брайт-B 4 Textile Yellow,126 950
Модульный диван Нолан-B Textile Beige,91 470
Модульный диван Нолан-B 1 Textile Beige,145 450
Модульный диван Нолан-B Textile Dusty Blue,91 470
Модульный диван Нолан-B 1 Textile Dusty Blue,145 450
Модульный диван Нолан-B Textile Orange,91 470
Модульный диван Нолан-B 2 Textile Beige,198 440
Модульный диван Нолан-B 2 Textile Dusty Blue,198 440
Модульный диван Нолан-B 2 Textile Orange,198 440
Модульный диван Нолан-W Textile Beige,91 470
Модульный диван Нолан-W 1 Textile Beige,145 450
Модульный диван Нолан-W Textile Dusty Blue,91 470
Модульный диван Нолан-W 2 Textile Dusty Blue,198 440
Модульный диван Нолан-W 1 Textile Dusty Blue,145 450
Модульный диван Нолан-W Textile Yellow,91 470
Модульный диван Нолан-W 2 Textile Yellow,198 440
Модульный диван Нолан-W 1 Textile Yellow,145 450
Диван Рутс Black,65 990
Диван Рутс Beige,65 990
Модульный диван Мидеро Textile Navy Blue,71 980
Модульный диван Мидеро Textile Beige,71 980
Модульный диван Мидеро-1 Textile Beige,118 460
Модульный диван Мидеро-1 Textile Navy Blue,118 460
Модульный диван Мидеро-2 Textile Beige,157 450
Модульный диван Мидеро-2 Textile Navy Blue,157 450
Диван Франс Olive,24 990
Набор мебели Видьют Linen,44 990
Диван Крис Beige,13 490
Набор мебели Видьют Apricot,44 990
Диван Крис Blue,13 490
Диван Лигеро,28 990
Диван Lotus Textile Silver,89 990
Диван Lotus Textile Olive,89 990
Садовые качели Эйприл Beige,24 990
Садовые качели Эйприл Grey,24 990
Диван Lotus Textile Ginger,89 990
Диван Lotus-1 Textile Olive,129 990
Диван Коби Cream,59 990
Диван Альфи Milk,74 990
Диван Ланкастер Textile Milk,60 990
Диван Литта Black,42 990
Модульный диван Хайленд Textile Beige,155 980
Модульный диван Хайленд Textile Grey,155 980
Модульный диван Брайт-1 Textile Grafit,47 970
Модульный диван Брайт-5 Textile Grafit,128 930
Модульный диван Брайт-3 Textile Grafit,82 950
Модульный диван Брайт-4 Textile Grafit,93 950
Диван Крис Olive,13 490
Диван угловой Ларонсо Textile Grey,129 990
Диван Кела Мини Velvet Ginger,39 990
Диван Маре Мини Velvet Blue,27 990
Диван Массе Velvet Blue,64 990
Диван Массе Velvet Ginger,64 990
Диван Онте Bucle Eclipce,98 990
Диван Онте Bucle Silver,98 990
Диван Онте Bucle Mint,98 990
Диван Онте Textile Grey,119 990
Диван Онте Textile Night,119 990
Диван Онте Bucle Grafit,98 990
Диван Льери Barhat Olive,84 990
Диван Льери Barhat Wet Sand,84 990
Диван угловой Льери Barhat Olive,104 990
Диван угловой Льери Barhat Wet Sand,104 990
Диван Мисл Barhat Olive,79 990
Диван Мисл Barhat Wet Sand,79 990
Диван угловой Мисл-1 Barhat Olive,119 990
Диван угловой Мисл-1 Barhat Wet Sand,119 990
Диван Ситено Barhat Olive,62 990
Диван Ситено Barhat Wet Sand,62 990
Диван угловой Ситено Barhat Olive,72 990
Диван угловой Ситено Barhat Wet Sand,72 990
Диван Льери-1 Soft Light,0
Диван Арил Velvet Grafit,0
Диван Ольен Happy Latte,0
Диван Арил Velvet Latte,0
Диван Эби Happy Grey,0
Диван Роттердам-3 Velvet Light,0
Кушетка Берил Velvet Beige,0
Диван Арил Velvet Pink,0
Диван Арил Velvet Emerald,0
Диван Динс Мини Velvet Latte,0
Диван Кускен Velvet Grafit,0
Диван Роттердам Velvet Grey,0
Диван Кита Textile Cream,0
Диван Милкен Velvet Grafit,0
Диван Бонс-Т Happy Light,0
Диван Арил Velvet Navy Blue,0
Диван Мира Velvet Pink,0
Диван угловой Эби-1 Gene Ocean,0
Модульный диван Полан-5 Velvet Beige,0
Диван Роттердам-3 Velvet Pink,0
Диван Роттердам Velvet Black,0
Диван Саннес Velvet Light,0
Модульный диван Полан-4 Velvet Beige,0
Диван Льери Bucle White,0
Модульный диван Полан-1 Velvet Beige,0
Диван Эби Happy Emerald,0
Диван Бонс-Т Happy Mint,0
Диван угловой Плэнтис Velvet Ocean,0
Диван Слипсон Мини Linia Mint,0
Диван Льери Мини Bucle White,0
Диван Кита Textile Grey,0
Диван Арил Velvet Yellow,0
Диван угловой Эби-2 Happy Yellow,0
Диван угловой Слипсон Happy Ocean,0
Диван Кита Textile Olive,0
Диван Слипсон Happy Yellow,0
Диван угловой Дисент-2 Bucle White,0
Диван Роттердам-3 Velvet Green,0
Диван Арил Velvet Grey,0
Диван угловой Сваут Velvet Ocean,0
Диван Остин Velvet Yellow,0
Диван Роден-2 Black,0
Диван Саннес Textile Yellow,0
Диван угловой Санту-2 Navy Blue,0
Диван Сан-Паулу Velvet Ocean,0
Диван Гритон Мини Textile Grey,0
Кушетка Летто Textile Blue,0
Диван Орнен Barhat Beige,0
Кушетка Мона Barhat Salmon,0
Диван Гритон Мини Textile Grey,0
Кушетка Летто Textile Blue,0
Диван Орнен Barhat Beige,0
Кушетка Мона Barhat Salmon,0
Диван Мурано 160 Velvet Ocean,0
Диван Фида Velvet Latte,0
Диван Карлос-3 Red,0
Кушетка Лори Textile Ocean,0
Диван Вернон Velvet Mustard,0
Диван Фолс 160 Velvet Coral,0
Диван угловой Инарт Happy Yellow,0
Диван Ситено Мини Barhat Mint,0
Диван Монреаль Премиум Barhat Grey,0
Диван Поли Velvet Navy Blue,0
Диван Айверс Textile Beige,0
Диван Старк Velvet Ocean,0
Диван угловой Мурано Velvet Ocean,0
Диван Берг Velvet Navy Blue,0
Диван Байвин Soft Navy Blue,0
Диван угловой Милбург Textile Rustic,0
Диван Линкольн Light,0
Диван угловой Ротшильд White,0
Диван Осло-3 Beige,0
Диван Дублин Happy Grafit,0
Модульный диван Винсор-1 Velvet Beige,0
Диван Медиус-3 Beige,0
Диван Вернон 160 Velvet Ocean,0
Диван Роден-2 Brown,0
Диван Анта Barhat Blue,0
Диван Коро Velvet Olive,0
Кушетка Дилси Barhat Salmon,0
Диван Коро Velvet Emerald,0
Диван Динс Sherst Blue,0
Диван Артилс Velvet Grey,0
Диван угловой Торин Brown,0
Диван Орнен Barhat Silver,0
Диван Мосс Happy Beige,0
Диван угловой Мидгард Zamsha Brown,0
Диван Крокус-3 White,0
Диван Ротшильд Luna,0
Диван Динс Smart Beige,0
Диван Виена Velvet Pouder,0
Диван угловой Санту-1 Textile Plum,0
Диван Шарп 160 Velvet Grey,0
Диван Коренс-3 Happy Emerald,0
Модульный диван Монреаль-2 Ocean,0
Диван Кускен Textile Mint,0
Диван Сайле Barhat Grey,0
Диван Аруби Velvet Coral,0
Диван Монреаль Zamsha Brown,0
Диван угловой Лориш Beige,0
Диван Лисмос Buffalo Brown,0
Диван угловой Мисл-1 Barhat Light,0
Диван угловой Спейс-1 Happy Ocean,0
Диван Офра Happy Grey,0
Диван Сайле Barhat Amber,0
Диван Сваут Barhat Mint,0
Диван Роттердам Chess Black,0
Диван Кела Мини Velvet Pink,0
Модульный диван Монреаль-3 Zamsha Brown,0
Диван Вернон 160 Velvet Emerald,0
Диван угловой Санту-2 Textile Ocean,0
Диван Шарп Happy Yellow,0
Кушетка Балтик Textile Light,0
Диван угловой Лориш Grey,0
Диван угловой Медиус Beige,0
Кушетка Лунд Textile Sky,0
Диван Вероли Velvet Light Grey,0
Кушетка Магни Blue,0
Диван Сите-2 Barhat Salmon,0
Диван угловой Манхэттен Velvet Navy Blue,0
Диван Сайле Buffalo Brown,0
Диван Соланс Velvet Eclipse,0
Диван угловой Милбург Textile Navy Blue,0
Модульный диван Этен 2 Time Grey,0
Диван Ситено Мини Velvet Light,0
Модульный диван Динс-1 Textile Blue,0
Диван Лиент Velvet Blue,0
Диван Ваймон Velvet Grey,0
Кушетка Астер-3 Textile Sky,0
Диван Бастон-2 Red,0
Диван Торонто Velvet Brown,0
Диван угловой Милбург Textile Brown,0
Модульный диван Монреаль-4 Палермо Gris,0
Диван Плиди Chess Black,0
Диван Старк 160 Velvet Ocean,0
Диван Лиент Velvet Ocean,0
Кушетка Магни Green,0
Диван Дания-2 Barhat Ginger,0
Диван Стокгольм 242,0
Диван угловой Динс Velvet Emerald,0
Модульный диван Риббл-5 Bucle Blue,0
Диван Виена Velvet Mint,0
Диван Слипсон Мини Time Grafit,0
Диван Монти 155,0
Диван Осло-3 Black,0
Диван Лофт Velvet Latte,0
Модульное кресло Полан Velvet Coral,0
Диван Лофт Gene Grey,0
Диван угловой Джерси Velvet Grey,0
Диван Сан-Паулу Velvet Grey,0
Диван Кареро Velvet Light Grey,0
Диван Миннесота Textile Latte,0
Диван Белисса Velvet Blue,0
Диван Мурано Velvet Latte,0
Диван Фабиус Ecru,0
Диван Фабиус Blue,0
Модульное кресло Полан Velvet Provance,0
Диван Виена Velvet Beige,0
Диван Дара Happy Mint,0
Диван Нодис Happy Light,0
Диван Монреаль Grafit,0
Диван Ридан Barhat Ginger,0
Диван угловой Дисент-2 Velvet Ocean,0
Диван Вернон Velvet Blue,0
Диван Орнен Velvet Ocean,0
Модульный диван Монреаль-2 Палермо Gris,0
Диван Сан-Паулу Velvet Ocean,0
Диван Брент Velvet Light,0
Диван Напа Velvet Light Grey,0
Диван Маре Мини Velvet Mauve,0
Диван Медиус-2 Latte,0
Диван Фабиус Lilac,0
Диван Хоуп Velvet Grey,0
Диван Офра Happy Emerald,0
Диван Сан-Паулу Velvet Grafit,0
Диван Карлос-3 Black,0
Диван Осло-3 White,0
Кушетка Лори Textile Cream,0
Кушетка Ситено Barhat Salmon,0
Диван Соланс Velvet Atlantic,0
Диван Орнен Barhat Gold,0
Диван Мосс 160 Happy Pink,0
Диван Роттердам Ocean,0
Кушетка Манс Barhat Ocean,0
Диван Нодис Happy Emerald,0
Диван Реджио Soft Navy Blue,0
Диван Ларонсо Velvet Emerald,0
Кушетка Астер Textile Lime,0
Диван Ольен Мини Happy Mint,0
Диван Дисент Velvet Emerald,0
Диван Хевит Barhat Grey,0
Модульный диван Винсор-2 Velvet Terra,0
Диван Бриес Barhat Ginger,0
Диван Мисл Barhat Gold,0
Диван Нодис Happy Mint,0
Модульный диван Динс-1 Textile Ocean,0
Диван угловой Дарол Gene Navy Blue,0
Диван Гритон Мини Textile Sky,0
Модульный диван Монреаль-3 Палермо Gris,0
Диван Ларонсо Velvet Ocean,0
Модульный диван Крокус-2 Latte,0
Диван Котн Textile Sky,0
Диван угловой Манхэттен Velvet Yellow,0
Диван Лайтси Velvet Grey,0
Диван Линкольн Rubino,0
Модульный диван Полан-2 Velvet Coral,0
Диван Осло-3 Red,0
Модульный диван Крокус-1 Latte,0
Диван Дублин-3 Happy Ocean,0
Диван Фолс Velvet Ocean,0
Диван Эдрил Barhat Beige,0
Диван Лориш Yellow,0
Диван угловой Санту-1 Textile Yellow,0
Диван угловой Сваут Velvet Yellow,0
Диван Дублин Happy Light,0
Диван угловой Спейс-1 Soft Ocean,0
Диван угловой Монсо Happy Light,0
Диван Котн Textile Navy Blue,0
Модульный диван Монреаль-4 Zamsha Brown,0
Диван угловой Льери Bucle White,0
Диван Айверс Textile Blue,0
Диван Мона Barhat Beige,0
Диван Шери Happy Light,0
Диван Сан-Паулу Velvet Pink,0
Диван Кита Textile Grafit,0
Диван Роттердам-3 Barhat Ginger,0
Диван Льери Velvet Ocean,0
Диван Дисент Land Light,0
Диван Сан-Паулу Velvet Grey,0
Диван Эннис Textile Yellow,0
Кушетка Летто Textile Yellow,0
Диван угловой Торин Purple,0
Диван Ларонсо Soft Pink,0
Диван Орнен Velvet Grey,0
Диван угловой Плэнтис Velvet Grafit,0
Диван Хевит Barhat Latte,0
Диван Фабиус Light Grey,0
Диван Динс Мини Barhat Emerald,0
Диван угловой Напа Velvet Ocean,0
Диван Кита Textile Mint,0
Диван Джуна Velvet Latte,0
Диван Анта Velvet Silver,0
Диван Монреаль Zamsha Grey,0
Диван Ваймон Velvet Light,0
Диван угловой Джерси Velvet Grafit,0
Диван угловой Торин Light,0
Диван Ситено Мини Velvet Grafit,0
Диван Лоелс Happy Emerald,0
Диван Монреаль Палермо Mustard,0
Диван Каир Textile Brown,0
Диван Вероли Velvet Corall,0
Модульный диван Винсор-3 Velvet Terra,0
Диван угловой Льери Velvet Ocean,0
Диван Хевит Barhat Salmon,0
Диван Кайрон Velvet Coral,0
Диван Честер-3 Velvet Latte,0
Диван Сайле Soft Light,0
Кушетка Манс Barhat Mint,0
Диван Нодис Happy Grey,0
Модульный диван Динс-2 Velvet Emerald,0
Диван Эдрил Barhat Salmon,0
Диван Ксанти Happy Grafit,0
Диван Виас Velvet Navy Blue,0
Диван Виена Velvet Pink,0
Диван Вернон Velvet Ocean,0
Диван Дара Happy Yellow,0
Диван угловой Гритон Textile Beige,0
Модульный диван Крокус-1 Black,0
Диван угловой Дисент-2 Land Terra,0
Диван Менли Velvet Yellow,0
Диван Ситено Мини Barhat Emerald,0
Диван угловой Эби-2 Happy Mint,0
Диван Анта Velvet Grafit,0
Диван Илар Velvet Latte,0
Диван Слипсон Мини Gene Emerald,0
Диван Кускен Smart Tango,0
Диван Шенто Barhat Mint,0
Диван угловой Плэнтис Velvet Emerald,0
Диван угловой Дисент-2 Velvet Grey,0
Диван угловой Корс Velvet Grey,0
Диван Динен Velvet Black,0
Диван Хоуп Velvet Latte,0
Диван Лилле Velvet Grey,0
Кушетка Мона Barhat Grey,0
Диван угловой Джерси Velvet Plum,0
Диван Остин 160 Velvet Blue,0
Кушетка Ситено Barhat Emerald,0
Диван Плиди Happy Yellow,0
