name,price,exist
Диван угловой Льери Мини Velvet Light,69 990,В наличии
Диван Риббл-10 Bucle Eclipce,83 990,В наличии
Диван Винси Soft Grey,22 990,В наличии
Модульное кресло Полан Cozy Ivory,56 970,В наличии
Диван угловой Эби-2 Velvet Blue,98 990,В наличии
Диван угловой Нордика мини Velvet Olive,59 990,В наличии
Диван Льери-1 Soft Ocean,59 990,В наличии
Модульный диван Brera-8 Velour Lilac,123 970,В наличии
Модульный диван Нолан-W 1 Soft Latte,81 980,В наличии
Диван Стаус Мини Textile Grafit,24 990,В наличии
Диван Спейс Velvet Beige,64 990,В наличии
Диван Боско-3 Land Grey,49 990,В наличии
Диван Риббл-1 Bucle Silver,68 990,В наличии
Модульный диван Brera-6 Velour Caramel,171 960,В наличии
Диван Риббл-10 Bucle Lilac,83 990,В наличии
Диван Клаймар Velvet Beige,57 990,В наличии
Диван Викс Textile Coral,21 990,В наличии
Диван Слипсон Velvet Emerald,59 990,В наличии
Диван Порту Мини Textile Silver,26 990,В наличии
Диван угловой Виена Velvet Corall,69 990,В наличии
Диван Соланс Velvet Lime,29 990,В наличии
Диван Эби Velvet Blue,64 990,В наличии
Диван угловой Харинг Soft Milk,92 990,В наличии
Диван угловой Виллес Velvet Blue,56 990,В наличии
Диван Пайпел Bucle White,49 990,В наличии
Диван Бруквиль Velvet Beige,49 990,В наличии
Кушетка Дилси Textile Blue,37 990,В наличии
Модульный диван Сэндж 2 Textile Ocean,58 970,В наличии
Диван Майнап Velvet Navy Blue,46 990,В наличии
Модульный диван Полан-3 Velvet Light,70 960,В наличии
Диван Сите-3 Velvet Eclipse,39 990,В наличии
Диван угловой Мейлон Velvet Smoke,49 990,В наличии
Диван угловой Вайвел Barhat Blue,89 990,В наличии
Диван Эби Мини Linia Pink,56 990,В наличии
Диван Ларонсо Soft Terra,84 990,В наличии
Диван угловой Амрано Velvet Grey,42 990,В наличии
Диван угловой Онте Textile Night,129 990,В наличии
Диван Бруквиль Cozy Ivory,62 990,В наличии
Диван угловой Биани-1 Barhat Latte,79 990,В наличии
Диван Спейс-2 Velvet Terra,89 990,В наличии
Диван Кинси-2 Land Black,49 990,В наличии
Диван угловой Ройн Мини Velvet Blue,42 990,В наличии
Модульный диван Brera-3 Velour Mix,113 970,В наличии
Кушетка Манс Velvet Coral,32 990,В наличии
Модульный диван Риббл-1 Bucle Beige,76 980,В наличии
Диван угловой Плэнтис Velvet Plum,98 990,В наличии
Модульный диван Полан-3 Velvet Smoke,70 960,В наличии
Диван угловой Эби-1 Velvet Smoke,72 990,В наличии
Модульный диван Нолан-W 4 Soft Milk,146 450,В наличии
Диван Порту Textile Yellow,25 990,В наличии
Диван Сите-3 Barhat Beige,39 990,В наличии
Диван угловой Плэнтис Soft Light,124 990,В наличии
Диван Порту Мини Textile Yellow,26 990,В наличии
Диван Риббл-7 Bucle Silver,51 990,В наличии
Диван угловой Харинг Soft Grey,92 990,В наличии
Диван Риард-2 Land Sky,38 990,В наличии
Диван угловой Слипсон Velvet Plum,66 990,В наличии
Диван Сорен Textile Ocean,59 990,В наличии
Кушетка Венето Velvet Blue,38 990,В наличии
Кушетка Кото Cozy Ginger,46 990,В наличии
Диван Льери-1 Soft Olive,59 990,В наличии
Диван Спейс Velvet Grey,64 990,В наличии
Диван Бонс-Т Velvet Silver,44 990,В наличии
