name,price
Диван Риббл-10 Bucle Mint,83 990
Диван Сторм Land Grey,54 990
Диван Массе Velvet Mint,59 990
Диван Лофт Linia Silver,45 990
Модульный диван Нолан-W 1 Soft Grafit,81 980
Диван угловой Харинг Soft Night,92 990
Диван Данста Textile Honey,79 990
Диван Картос Velvet Terra,52 990
Диван Гарди Soft Milk,34 990
Диван Арклоу Cozy Storm,52 990
Диван угловой Динс Velvet Stone,59 990
Диван угловой Нумо Velvet Green,47 990
Диван Дара Velvet Emerald,44 990
Диван угловой Вильен мини Velvet Terra,59 990
Диван угловой Плэнтис Velvet Beige,98 990
Диван угловой Мисл-1 Barhat Marsala,109 990
Диван Коренс Bucle Green,38 990
Диван Тут Рядом Дом Зеленый,72 990
Кушетка Ринт Bucle Pink,20 990
Модульный диван Риббл-3 Bucle Lilac,153 970
Диван Боско-3 Land Blue,49 990
Диван Пайпел Bucle Grafit,49 990
Диван Гарди Soft Pink,34 990
Кушетка Кото Cozy Ivory,46 990
Диван Кускен Velvet Red,46 990
Диван Нумо Мини Textile Navy Blue,24 990
Диван Леймарк мини Barhat Blue,46 990
Диван Мисл Barhat Rose,79 990
Диван угловой Биани-2 Barhat Blue,98 990
Диван Нумо Velvet Grafit,37 990
Диван Пайпел Bucle Yellow,49 990
Диван Риббл-2 Bucle Lilac,68 990
Диван Мейлон Velvet Beige,47 990
Кушетка Роби Textile Yellow,19 990
Диван Кареро Bucle Mint,82 990
Диван угловой Слипсон Velvet Emerald,66 990
Модульный диван Полан-1 Velvet Terra,73 970
Диван Риард-3 Land Black,46 990
Диван угловой Амрано Velvet Emerald,42 990
Модульный диван Нолан-W 1 Soft Jungle,81 980
Модульный диван Brera-2 Velour Smoke,105 980
Модульный диван Brera-6 Velour Cherry,171 960
Модульный диван Этен 6 Vertical Jeans,82 960
Диван Мона Velvet Beige,29 990
Диван Коренс Happy Yellow,30 990
Модульный диван Нолан-W 2 Soft Night,91 470
Модульный диван Этен 4 Vertical Milk,203 920
Диван Коренс-3 Bucle White,46 990
Диван Майнап Velvet Light,46 990
Диван Гарди Soft Jungle,34 990
Диван Кускен Velvet Yellow,46 990
Диван Мона Velvet Yellow,29 990
Диван Лави Velvet Smoke,43 990
Модульный диван Нолан-W 2 Soft Grafit,91 470
Модульный диван Нолан-W 4 Soft Yellow,146 450
Модульный диван Полан-1 Velvet Smoke,73 970
Диван угловой Лаберт Barhat Forest,109 990
Модульный диван Нолан-W 2 Soft Milk,91 470
Диван Мира Velvet Yellow,43 990
Кушетка Кото Cozy Emerald,46 990
Диван угловой Льери Barhat Beige,98 990
Диван Слипсон Velvet Milk,59 990
Диван угловой Аллаум Linia Silver,52 990
Диван Сторм Land Latte,54 990
Модульный диван Полан-5 Velvet Light,127 950
Диван Леймарк мини Barhat Terra,46 990
Диван угловой Дарол Velvet Emerald,64 990
Кушетка Берил Velvet Ocean,35 990
Диван Мисл Barhat Stone,74 990
Диван Риен Velvet Beige,49 990
Диван угловой Дарол Velvet Navy Blue,64 990
Диван Льери Barhat Silver,79 990
Диван Риббл-6 Bucle Mint,51 990
Кушетка Венето Velvet Poudre,38 990
Диван Лейсон Velvet Mint,49 990
Диван Динс Velvet Navy Blue,54 990
Диван угловой Порту Textile Yellow,32 990
Диван Рейли Velvet Grey,34 990
Диван угловой Ройн Мини Velvet Terra,42 990
Диван Роттердам Velvet Yellow,25 990
Диван угловой Аронт Мини Velvet Grey,58 990
Диван угловой Бруквиль Velvet Grey,59 990
Диван Кела Мини Velvet Beige,39 990
Диван Ольен Мини Velvet Sand,54 990
Диван угловой Шера Velvet Light,102 990
Диван Нумо Velvet Light,37 990
Диван угловой Маркфул Velvet Light,79 990
Модульный диван Полан-5 Velvet Moss,127 950
Диван Сите-3 Velvet Coral,39 990
Диван Кускен Velvet Sand,46 990
Диван Боско-2 Land Blue,39 990
Диван Кинси-3 Land Grafit,56 990
Диван Ольен Velvet Yellow,64 990
Кушетка Интори Soft Jungle,28 990
Диван Бруквиль Velvet Blue,49 990
Диван Спейс-2 Velvet Blue,89 990
Модульный диван Нолан-B 3 Soft Grafit,114 970
Модульный диван Brera-3 Velour Cinnamon,113 970
Диван угловой Нумо Velvet Yellow,47 990
Диван Мира Velvet Grey,43 990
Диван Леймарк Velvet Beige,49 990
Модульный диван Этен 2 Vertical Milk,149 940
Диван Пайпел Bucle Forest,49 990
Диван угловой Порту Textile Grafit,32 990
Диван угловой Виена Velvet Light,69 990
Модульный диван Brera-1 Bucle Beige,256 950
Диван Коренс Bucle White,38 990
Диван Ларонсо Soft Pearl,84 990
Диван Види Textile Light,25 990
Диван Лонди Bucle Marble,52 990
Кушетка Манс Velvet Grey,32 990
Диван угловой Майнап Velvet Grafit,49 990
Диван Шилдс Textile Ginger,86 990
Диван Шилдс Bucle Marble,79 990
Диван Роттердам Velvet Blue,25 990
Кушетка Оренте Soft Latte,46 990
Диван Риард-3 Land Marsala,46 990
Модульный диван Риббл-3 Bucle Forest,153 970
Модульный диван Нолан-B 5 Soft Milk,198 440
Диван угловой Эби-1 Happy Light,72 990
Модульное кресло Полан Velvet Moss,43 970
Модульный диван Brera-5 Velour Galaxy,120 980
Модульный диван Нолан-B 4 Soft Night,146 450
Модульный диван Brera-5 Velour Mix,120 980
Диван угловой Виллес Velvet Beige,56 990
Диван Порту Textile Grafit,25 990
Диван Сорен Textile Grey,59 990
Модульный диван Риббл-3 Bucle Silver,153 970
Диван угловой Вайвел Barhat Ginger,89 990
Диван Льери Мини Velvet Light,64 990
Диван Види Textile Navy Blue,25 990
Диван Бруквиль Velvet Smoke,49 990
Модульный диван Этен Vertical Terra,81 960
Диван Стаус Velvet Stone,30 990
Модульный диван Brera-7 Velour Stone,177 970
Диван Слипсон Мини Linia Beige,44 990
Диван Нумо Мини Textile Sky,24 990
Кушетка Кото Cozy Beige,46 990
Диван Милкен Vertical Jeans,45 990
Кушетка Тут Рядом Космос Графитовый,89 990
Диван Саннес Velvet Olive,49 990
Диван Виенсо Bucle Ginger,79 990
Диван Лилле Velvet Grey,49 990
Диван Лилле Velvet Stone,49 990
Диван угловой Вильен мини Velvet Olive,59 990
Модульный диван Риббл-1 Bucle Forest,76 980
Диван угловой Сайле Barhat Navy Blue,139 990
Диван Сорен Textile Navy Blue,59 990
Диван Ниса Land Marsala,44 990
Модульное кресло Полан Velvet Light,43 970
Диван Пайпел-3 Bucle Beige,54 990
Диван Дара Velvet Yellow,44 990
Модульный диван Этен 6 Vertical Light,82 960
Диван Сваут Velvet Grey,66 990
Кушетка Норфолк Velvet Pink,25 990
Диван угловой Биани-2 Barhat Latte,98 990
Диван Марей Soft Ginger,89 990
Диван Эби Мини Linia Silver,56 990
Диван Эрвин-2 Grey,30 990
Модульный диван Brera-6 Bucle Beige,222 960
Кушетка Норфолк Velvet Light,25 990
Диван Эби Мини Linia Mint,56 990
Диван Риббл-6 Bucle Forest,51 990
Диван Кела Мини Velvet Silver,39 990
Диван Эби Velvet Coral,64 990
Диван угловой Ситено Barhat Light,69 990
Диван Винси Soft Navy Blue,22 990
Модульный диван Риббл-2 Bucle Silver,128 980
Диван Клаймар Velvet Blue,57 990
Диван Шилдс Textile Night,86 990
Диван Стаус Velvet Grey,30 990
Диван Картос Velvet Yellow,52 990
Модульный диван Риббл-2 Bucle Eclipce,128 980
Диван Риббл-11 Bucle Lilac,83 990
Диван Дара Velvet Milk,44 990
Диван Рейли Velvet Light,34 990
Кушетка Берил Velvet Olive,35 990
Диван Кинси-3 Land Black,56 990
Диван угловой Эдвин Velvet Grey,69 990
Диван Спейс Soft Navy Blue,64 990
Диван Гарди Soft Terra,34 990
Диван Лофт Linia Yellow,45 990
Кушетка Олтен Textile Grafit,32 990
Диван Рон Textile Yellow,54 990
Диван Сторм Land Yellow,54 990
Диван угловой Маркфул Velvet Grey,79 990
Диван Сорен Textile Beige,59 990
Диван Леймарк мини Barhat Olive,46 990
Диван Лесли Velvet Sand,46 990
Кушетка Оренте Soft Mint,46 990
Диван Винси Soft Olive,22 990
Диван Риард-2 Land Marsala,38 990
Модульный диван Сэндж 3 Textile Sky,78 960
Диван Кейсес Velvet Yellow,26 990
Кушетка Дилси Textile Grafit,37 990
Диван Данста Textile Gold,79 990
Модульный диван Нолан-W 3 Soft Grey,114 970
Кушетка Норфолк Velvet Grafit,25 990
Модульный диван Нолан-B 3 Soft Grey,114 970
Диван угловой Ларонсо Soft Blue,109 990
Диван Риард-2 Land Stone,38 990
Диван угловой Вильен мини Velvet Caramel,59 990
Модульный диван Нолан-W 5 Soft Milk,198 440
Диван Ларонсо Bucle Shadow,89 990
Диван угловой Льери Мини Velvet Yellow,69 990
Диван Порту Мини Textile Grafit,26 990
Диван Льери Мини Velvet Yellow,64 990
Диван угловой Виллес Velvet Olive,56 990
Диван Кинси-2 Land Marsala,49 990
Диван угловой Бонент Velvet Grey,92 990
Диван угловой Лилле Velvet Light,59 990
Модульный диван Полан-3 Velvet Ocean,70 960
Диван Динс Мини Velvet Yellow,49 990
Кушетка Олтен Textile Forest,32 990
Диван Льери-1 Soft Grey,59 990
Диван Стаус Мини Textile Silver,24 990
Диван Бонс-Т Velvet Emerald,44 990
Модульный диван Brera-8 Velour Mix,123 970
Диван угловой Дисент-2 Soft Light,139 990
Диван Льери-1 Soft Latte,59 990
Диван Леймарк мини Barhat Smoke,46 990
Диван Ольен Мини Velvet Silver,54 990
Диван Сваут Velvet Beige,66 990
Диван угловой Слипсон Happy Yellow,66 990
Диван Данста Velvet Smoke,66 990
Диван угловой Бонент Velvet Moss,92 990
Диван Порту Мини Textile Beige,26 990
Диван Риббл-6 Bucle Grafit,51 990
Диван Дисент Velvet Stone,79 990
Диван угловой Льери Мини Velvet Light,69 990
Диван Риббл-10 Bucle Eclipce,83 990
Диван Винси Soft Grey,22 990
Модульное кресло Полан Cozy Ivory,56 970
Диван угловой Эби-2 Velvet Blue,98 990
Диван угловой Нордика мини Velvet Olive,59 990
Диван Льери-1 Soft Ocean,59 990
Модульный диван Brera-8 Velour Lilac,123 970
Модульный диван Нолан-W 1 Soft Latte,81 980
Диван Стаус Мини Textile Grafit,24 990
Диван Спейс Velvet Beige,64 990
Диван Боско-3 Land Grey,49 990
Диван Риббл-1 Bucle Silver,68 990
Модульный диван Brera-6 Velour Caramel,171 960
Диван Риббл-10 Bucle Lilac,83 990
Диван Клаймар Velvet Beige,57 990
Диван Викс Textile Coral,21 990
Диван Слипсон Velvet Emerald,59 990
Диван Порту Мини Textile Silver,26 990
Диван угловой Виена Velvet Corall,69 990
Диван Соланс Velvet Lime,29 990
Диван Эби Velvet Blue,64 990
Диван угловой Харинг Soft Milk,92 990
Диван угловой Виллес Velvet Blue,56 990
Диван Пайпел Bucle White,49 990
Диван Бруквиль Velvet Beige,49 990
Кушетка Дилси Textile Blue,37 990
Модульный диван Сэндж 2 Textile Ocean,58 970
Диван Майнап Velvet Navy Blue,46 990
Модульный диван Полан-3 Velvet Light,70 960
Диван Сите-3 Velvet Eclipse,39 990
Диван угловой Мейлон Velvet Smoke,49 990
Диван угловой Вайвел Barhat Blue,89 990
Диван Эби Мини Linia Pink,56 990
Диван Ларонсо Soft Terra,84 990
Диван угловой Амрано Velvet Grey,42 990
Диван угловой Онте Textile Night,129 990
Диван Бруквиль Cozy Ivory,62 990
Диван угловой Биани-1 Barhat Latte,79 990
Диван Спейс-2 Velvet Terra,89 990
Диван Кинси-2 Land Black,49 990
Диван угловой Ройн Мини Velvet Blue,42 990
Кушетка Манс Velvet Coral,32 990
Модульный диван Риббл-1 Bucle Beige,76 980
Диван угловой Плэнтис Velvet Plum,98 990
Модульный диван Полан-3 Velvet Smoke,70 960
Диван угловой Эби-1 Velvet Smoke,72 990
Модульный диван Нолан-W 4 Soft Milk,146 450
Диван Порту Textile Yellow,25 990
Диван Сите-3 Barhat Beige,39 990
Диван угловой Плэнтис Soft Light,124 990
Диван Порту Мини Textile Yellow,26 990
Диван Риббл-7 Bucle Silver,51 990
Диван угловой Харинг Soft Grey,92 990
Диван Риард-2 Land Sky,38 990
Диван угловой Слипсон Velvet Plum,66 990
Диван Сорен Textile Ocean,59 990
Кушетка Венето Velvet Blue,38 990
Кушетка Кото Cozy Ginger,46 990
Диван Льери-1 Soft Olive,59 990
Диван Спейс Velvet Grey,64 990
Диван Бонс-Т Velvet Silver,44 990
Диван Кейсес Velvet Grafit,26 990
Диван Бруквиль Velvet Grey,49 990
Диван Эби Happy Mint,59 990
Диван угловой Нордика мини Velvet Coral,59 990
Диван Лачи Velvet Beige,32 990
Диван Виена Bucle Green,89 990
Модульный диван Brera-1 Velour Plum,202 950
Диван Пайпел-3 Bucle Yellow,54 990
Диван Риббл-6 Bucle Eclipce,51 990
Диван Сорен Textile Light,59 990
Диван Стаус Мини Textile Blue,24 990
Диван Массе Velvet Pink,59 990
Диван Эби Мини Linia Beige,56 990
Диван Мона Velvet Blue,29 990
Модульный диван Риббл-2 Bucle Mint,128 980
Диван угловой Дисент-1 Soft Night,96 990
Диван угловой Майнап Velvet Olive,49 990
Диван Тилар Textile Grey,29 990
Диван угловой Амрано Velvet Caramel,42 990
Диван Эрвин-3 Grey,38 990
Модульный диван Brera-7 Velour Lilac,177 970
Диван Рон Textile Grafit,54 990
Модульный диван Brera-5 Velour Caramel,120 980
Диван Боско-3 Land Milk,49 990
Модульный диван Риббл-1 Bucle Lilac,76 980
Диван Кейсес Velvet Pink,26 990
Диван угловой Спейс-1 Velvet Terra,69 990
Модульный диван Нолан-B 2 Soft Milk,91 470
Диван угловой Бруквиль Cozy Ivory,74 990
Диван угловой Мисл-1 Barhat Beige,109 990
Диван Нумо Velvet Yellow,37 990
Диван Риббл-1 Bucle Mint,68 990
Модульный диван Этен 6 Vertical Terra,82 960
Диван Риббл-10 Bucle Forest,83 990
Диван Риббл-6 Bucle Silver,51 990
Диван Риббл-11 Bucle Silver,83 990
Модульный диван Сэндж 1 Textile Light,64 970
Диван Леймарк Velvet Silver,49 990
Диван Коренс Happy Grafit,30 990
Диван Ольен Мини Velvet Emerald,54 990
Диван Кинси-3 Land Light,56 990
Кушетка Манс Velvet Blue,32 990
Диван Слипсон Velvet Plum,59 990
Модульный диван Полан-4 Velvet Caramel,102 960
Диван Бонент Velvet Terra,76 990
Диван угловой Стаус Velvet Terra,42 990
Диван Лофт Linia Stone,45 990
Модульный диван Полан-2 Velvet Moss,93 960
Диван Сите-2 Velvet Coral,32 990
Диван Виенсо Bucle Milk,79 990
Диван угловой Нумо Velvet Grey,47 990
Диван Байма Velvet Plum,69 990
Модульный диван Полан-3 Velvet Moss,70 960
Диван Пайпел Bucle Blue,49 990
Диван угловой Льери Мини Velvet Blue,69 990
Модульный диван Brera-6 Velour Beige,171 960
Диван Лейсон Velvet Smoke,49 990
Диван угловой Майнап Velvet Light,49 990
Диван угловой Лилле Velvet Stone,59 990
Диван Кареро Bucle Cloud,82 990
Диван угловой Плэнтис Bucle Beige,124 990
Диван Арклоу Soft Latte,56 990
Диван Brera Velour Cinnamon,98 990
Кушетка Мона Velvet Blue,32 990
Модульный диван Нолан-B 2 Soft Grey,91 470
Модульный диван Нолан-B 3 Soft Milk,114 970
Диван Дисент Soft Silver,98 990
Модульный диван Нолан-W 4 Soft Night,146 450
Диван Динс Мини Velvet Navy Blue,49 990
Диван Риббл-6 Bucle Beige,51 990
Диван угловой Порту Textile Ocean,32 990
Диван Боско-2 Land Forest,39 990
Кушетка Норфолк Velvet Yellow,25 990
Диван угловой Эби-2 Velvet Light,98 990
Модульный диван Brera-3 Velour Lilac,113 970
Диван Льери Barhat Beige,79 990
Диван угловой Бруквиль Velvet Beige,59 990
Диван угловой Спейс-1 Velvet Beige,69 990
Кушетка Интори Soft Pink,28 990
Кушетка Ринт Bucle Blue,20 990
Диван Динс Мини Velvet Emerald,49 990
Модульный диван Brera-5 Velour Cinnamon,120 980
Диван Биани Barhat Olive,74 990
Диван угловой Онте Textile Grafit,129 990
Диван угловой Льери Мини Velvet Terra,69 990
Диван угловой Нумо Velvet Pink,47 990
Модульное кресло Полан Velvet Terra,43 970
Модульный диван Полан-5 Velvet Terra,127 950
Модульный диван Нолан-B 5 Soft Grafit,198 440
Диван угловой Спейс-2 Soft Navy Blue,98 990
Модульный диван Brera-5 Velour Smoke,120 980
Диван Мона Velvet Olive,29 990
Модульный диван Brera-5 Velour Stone,120 980
Диван Линс Velvet Grafit,34 990
Диван угловой Ситено Barhat Emerald,69 990
Диван Brera Velour Stone,98 990
Модульный диван Этен 4 Vertical Mix,203 920
Кушетка Манс Velvet Beige,32 990
Модульный диван Нолан-W 4 Soft Grey,146 450
Модульный диван Нолан-W 2 Soft Latte,91 470
Диван Дисент Velvet Smoke,79 990
Диван Лилле Velvet Terra,49 990
Диван угловой Вильен мини Velvet Grey,59 990
Диван угловой Спейс-1 Velvet Olive,69 990
Модульный диван Сэндж 1 Textile Ocean,64 970
Диван угловой Виллес Velvet Grey,56 990
Кушетка Роби Textile Blue,19 990
Диван Риббл-7 Bucle Grafit,51 990
Диван Спейс-2 Velvet Smoke,89 990
Кушетка Венето Velvet Mustard,38 990
Диван Маркфул Velvet Yellow,66 990
Диван Динс Velvet Stone,54 990
Диван Бонент Velvet Light,76 990
Модульный диван Сэндж 1 Textile Sky,64 970
Диван Клаймар Velvet Moss,57 990
Диван Милкен Velvet Sand,45 990
Диван Лилле Velvet Atlantic,49 990
Диван Биани Barhat Blue,74 990
Модульный диван Этен 1 Vertical Jeans,115 950
Диван Ниса Land Stone,44 990
Диван Боско-2 Land Grey,39 990
Модульный диван Нолан-B 4 Soft Jungle,146 450
Диван угловой Ларонсо Soft Silver,109 990
Модульный диван Риббл-4 Bucle Mint,153 970
Модульный диван Brera-3 Velour Night,113 970
Диван Динс Velvet Milk,54 990
Диван угловой Дисент-1 Soft Yellow,96 990
Диван Мисл Barhat White,74 990
Диван Леймарк мини Barhat Latte,46 990
Диван Види Textile Corall,25 990
Диван угловой Бонент Velvet Eclipse,92 990
Модульный диван Полан-4 Velvet Terra,100 960
Диван Лейсон Velvet Beige,49 990
Диван Тут Рядом Космос Синий,109 990
Диван Эби Мини Linia Yellow,56 990
Кушетка Оренте Soft Sky,46 990
Диван угловой Дисент-2 Velvet Stone,109 990
Диван Тут Рядом Дом Розовый,72 990
Модульный диван Нолан-B 3 Soft Latte,114 970
Диван угловой Стаус Velvet Caramel,42 990
Диван Brera Velour Olive,98 990
Диван Виенсо Bucle Smoky,79 990
Модульный диван Этен 5 Vertical Mint,77 960
Диван угловой Спейс-2 Velvet Grey,98 990
Диван Шилдс Textile Azure,86 990
Кушетка Кото Cozy Latte,46 990
Диван угловой Нордика мини Velvet Smoke,59 990
Диван Викс Textile Silver,21 990
Диван Кинси-2 Land Grafit,49 990
Диван угловой Амрано Velvet Coral,39 990
Диван угловой Аллаум Linia Lavender,52 990
Диван Риббл-7 Bucle Lilac,51 990
Диван угловой Стаус Velvet Grey,42 990
Кушетка Роби Textile Ocean,19 990
Диван Слипсон Velvet Silver,59 990
Диван Винси Soft Light,22 990
Диван Слипсон Velvet Honey,59 990
Диван Арклоу Soft Ginger,56 990
Модульный диван Полан-3 Cozy Ivory,89 960
Диван Риббл-2 Bucle Eclipce,68 990
Диван Леймарк Velvet Grafit,49 990
Кушетка Кото Cozy Storm,46 990
Диван угловой Порту Textile Silver,32 990
Диван Коренс-3 Happy Grafit,35 990
Кушетка Тут Рядом Космос Светло-Бежевый,89 990
Диван Стаус Velvet Terra,30 990
Модульный диван Полан-1 Velvet Moss,73 970
Диван Ниса Land Navy Blue,44 990
Диван Шилдс Bucle Beige,86 990
Диван угловой Дисент-1 Soft Milk,96 990
Кушетка Мона Velvet Grey,32 990
Модульный диван Риббл-4 Bucle Lilac,153 970
Диван Коренс-3 Happy Light,35 990
Диван Мейлон Velvet Terra,47 990
Диван угловой Мейлон Velvet Yellow,49 990
Диван угловой Биани-2 Barhat Olive,98 990
Диван Шилдс Bucle Silver,86 990
Кушетка Мона Velvet Coral,32 990
Диван угловой Бонент Velvet Plum,92 990
Кушетка Манс Velvet Yellow,32 990
Диван угловой Аронт Мини Velvet Yellow,58 990
Диван угловой Нордика мини Velvet Blue,59 990
Диван угловой Виена Velvet Smoke,69 990
Модульный диван Полан-4 Velvet Smoke,100 960
Диван угловой Бруквиль Velvet Smoke,59 990
Модульный диван Нолан-B 5 Soft Night,198 440
Диван Сторм Land Terra,54 990
Кушетка Олтен Textile Beige,32 990
Модульный диван Полан-5 Velvet Caramel,129 950
Модульный диван Нолан-W 5 Soft Grey,198 440
Модульный диван Нолан-B 3 Soft Jungle,114 970
Диван Лачи Velvet Emerald,32 990
Диван Кинси-3 Land Marsala,56 990
Модульный диван Нолан-W 2 Soft Yellow,91 470
Модульный диван Нолан-B 1 Soft Milk,81 980
Диван Рон Textile Light,54 990
Диван Слипсон Мини Linia Silver,44 990
Диван Динс Мини Velvet Lime,49 990
Диван Эби Velvet Light,64 990
Диван угловой Лилле Velvet Grey,59 990
Диван Риббл-2 Bucle Silver,68 990
Диван Риард-3 Land Sky,46 990
Диван Лейсон Velvet Stone,49 990
Диван Ларонсо Soft Latte,84 990
Диван Стаус Velvet Smoke,30 990
Диван угловой Ройн Мини Velvet Olive,42 990
Кушетка Олтен Textile Plum,29 990
Диван угловой Спейс-2 Velvet Beige,98 990
Кушетка Венето Velvet Coral,38 990
Диван Картос Velvet Grey,52 990
Модульный диван Полан-2 Velvet Light,93 960
Диван Ситено Barhat Mint,59 990
Диван Марей Soft Navy Blue,89 990
Модульный диван Brera-4 Velour Olive,161 970
Диван Боско-3 Land Terra,49 990
Диван Виена Velvet Olive,64 990
Кушетка Берил Velvet Grey,35 990
Диван Бонс-Т Happy Grey,44 990
Диван Стаус Мини Textile Yellow,24 990
