name,price,exist
Диван Рейли Velvet Mint,34 990,В наличии
Диван Мона Velvet Coral,29 990,В наличии
Диван Викс Textile Grafit,21 990,В наличии
Диван Нумо Velvet Grey,37 990,В наличии
Диван Хевит Velvet Eclipse,39 990,В наличии
Диван Лачи Velvet Silver,32 990,В наличии
Диван Риен Velvet Smoke,49 990,В наличии
Диван угловой Эдвин Velvet Moss,69 990,В наличии
Модульный диван Сэндж 3 Textile Light,78 960,В наличии
Диван Види Textile Ocean,25 990,В наличии
Диван Риббл-6 Bucle Lilac,51 990,В наличии
Диван Стаус Velvet Olive,30 990,В наличии
Диван Лави Velvet Yellow,43 990,В наличии
Диван Дисент Soft Ginger,98 990,В наличии
Диван Байма Velvet Beige,69 990,В наличии
Диван Терм Velvet Smoke,69 990,В наличии
Диван Виенсо Bucle Sand,79 990,В наличии
Кушетка Венето Velvet Terra,38 990,В наличии
Диван угловой Биани-1 Barhat Olive,79 990,В наличии
Диван Лачи Velvet Yellow,32 990,В наличии
Модульный диван Brera-4 Bucle Beige,206 970,В наличии
Диван угловой Мейлон Velvet Terra,49 990,В наличии
Диван Арклоу Soft Silver,56 990,В наличии
Диван угловой Майнап Velvet Navy Blue,49 990,В наличии
Модульный диван Нолан-B 4 Soft Yellow,146 450,В наличии
Диван Стаус Velvet Blue,30 990,В наличии
Диван Нумо Мини Textile Light,24 990,В наличии
Диван Порту Textile Brown,25 990,В наличии
Диван Кела Мини Velvet Grafit,39 990,В наличии
Диван Роттердам Velvet Olive,25 990,В наличии
Диван Данста Textile Night,79 990,В наличии
Диван Боско-3 Land Yellow,49 990,В наличии
Диван Нумо Velvet Latte,37 990,В наличии
Диван угловой Ларонсо Soft Pearl,109 990,В наличии
Диван Сваут Velvet Mustard,66 990,В наличии
Диван Данста Velvet Light,66 990,В наличии
Кушетка Интори Soft Night,28 990,В наличии
Диван Роттердам-3 Velvet Blue,31 990,В наличии
Диван Маре Мини Velvet Pink,27 990,В наличии
Диван угловой Онте Bucle Silver,109 990,В наличии
Диван угловой Амрано Velvet Stone,42 990,В наличии
Диван Сите-2 Barhat Beige,32 990,В наличии
Модульный диван Нолан-W 4 Soft Jungle,146 450,В наличии
Диван Самми Velvet Midnight,34 990,В наличии
Диван Самми Velvet Coral,34 990,В наличии
Диван Биани Bucle Beige,89 990,В наличии
Диван Арклоу Cozy Ivory,52 990,В наличии
Модульный диван Brera-7 Velour Mix,177 970,В наличии
Диван Саннес Velvet Silver,49 990,В наличии
Диван угловой Динс Velvet Navy Blue,59 990,В наличии
Диван Лофт Linia Nut,45 990,В наличии
Диван Кускен Vertiсal Lavender,46 990,В наличии
Модульный диван Нолан-B 5 Soft Jungle,198 440,В наличии
Диван угловой Шера Velvet Blue,102 990,В наличии
Модульный диван Риббл-3 Bucle Mint,153 970,В наличии
Диван Льери Мини Velvet Grey,64 990,В наличии
Кушетка Мона Velvet Olive,32 990,В наличии
Диван Самми Velvet Plum,34 990,В наличии
Диван Самми Velvet Beige,34 990,В наличии
Диван Тут Рядом Космос Бежевый,109 990,В наличии
Кушетка Роби Textile Coral,19 990,В наличии
Диван Байма Velvet Milk,69 990,В наличии
Кушетка Роби Textile Light,19 990,В наличии
Диван Маре Мини Velvet Silver,27 990,В наличии
Диван Риббл-11 Bucle Mint,83 990,В наличии
Диван Ситено Barhat Blue,59 990,В наличии
Диван Динс Мини Velvet Latte,49 990,В наличии
Диван угловой Виена Velvet Olive,69 990,В наличии
Диван угловой Эби-2 Velvet Coral,98 990,В наличии
Диван угловой Маркфул Velvet Emerald,79 990,В наличии
Модульный диван Нолан-B 1 Soft Grey,81 980,В наличии
Модульный диван Brera-7 Bucle Beige,216 970,В наличии
Диван Сторм Land Silver,54 990,В наличии
Диван Мира Velvet Navy Blue,43 990,В наличии
Модульный диван Полан-5 Velvet Ocean,127 950,В наличии
Кушетка Ринт Bucle Yellow,20 990,В наличии
Модульный диван Нолан-W 5 Soft Night,198 440,В наличии
Кушетка Оренте Soft Blue,46 990,В наличии
Диван Хевит Velvet Olive,39 990,В наличии
Диван Коренс-3 Happy Grey,35 990,В наличии
Диван Коренс-3 Happy Yellow,35 990,В наличии
Модульный диван Brera-3 Velour Plum,113 970,В наличии
Диван угловой Ларонсо Soft Latte,109 990,В наличии
Диван Мейлон Velvet Eclipse,47 990,В наличии
Модульный диван Полан-2 Cozy Ivory,114 960,В наличии
Модульный диван Brera-3 Velour Forest,113 970,В наличии
Диван угловой Лаберт Barhat Latte,109 990,В наличии
Диван угловой Виллес Velvet Stone,56 990,В наличии
Диван Виена Bucle Silver,89 990,В наличии
Диван Сите-3 Velvet Moss,39 990,В наличии
Модульное кресло Полан Velvet Caramel,45 970,В наличии
Диван угловой Мейлон Velvet Eclipse,49 990,В наличии
Диван Картос Velvet Beige,52 990,В наличии
Модульный диван Brera-4 Velour Plum,161 970,В наличии
Модульный диван Этен 3 Vertical Jeans,140 940,В наличии
Диван угловой Бонент Velvet Smoke,92 990,В наличии
Диван Нумо Мини Textile Grafit,24 990,В наличии
Диван Порту Textile Ocean,25 990,В наличии
Диван угловой Дисент-1 Soft Toffe,96 990,В наличии
Диван Спейс-2 Velvet Grey,89 990,В наличии
Диван Кареро Bucle Silver,82 990,В наличии
Модульный диван Риббл-1 Bucle Mint,76 980,В наличии
Модульный диван Риббл-4 Bucle Forest,153 970,В наличии
Диван угловой Слипсон Velvet Silver,66 990,В наличии
Диван угловой Лаберт Barhat Smoke,109 990,В наличии
Модульный диван Полан-2 Velvet Caramel,95 960,В наличии
Диван угловой Лаберт Barhat Olive,109 990,В наличии
Диван угловой Нумо Velvet Grafit,47 990,В наличии
Диван угловой Сайле Barhat Silver,139 990,В наличии
Кушетка Норфолк Velvet Silver,25 990,В наличии
Диван Лонди Bucle Smoky,52 990,В наличии
Модульный диван Нолан-B 3 Soft Yellow,114 970,В наличии
Диван Ситено Barhat Stone,59 990,В наличии
Диван Эби Мини Linia Navy,56 990,В наличии
Диван угловой Шера Velvet Smoke,102 990,В наличии
Модульный диван Brera-2 Velour Lilac,105 980,В наличии
Диван Талас Velvet Stone,39 990,В наличии
Диван Массе Velvet Light,59 990,В наличии
Диван Лофт Linia Olive,45 990,В наличии
Диван Мейлон Velvet Smoke,47 990,В наличии
Модульный диван Этен 5 Vertical Jeans,77 960,В наличии
Диван Мисл Barhat Marsala,74 990,В наличии
Диван угловой Аллаум Linia Stone,52 990,В наличии
Модульный диван Риббл-1 Bucle Grafit,76 980,В наличии
Диван Спейс-2 Velvet Beige,89 990,В наличии
Модульный диван Нолан-B 2 Soft Grafit,91 470,В наличии
Модульный диван Brera-2 Velour Caramel,105 980,В наличии
Кушетка Тут Рядом Космос Серый,89 990,В наличии
Диван угловой Динс Velvet Yellow,59 990,В наличии
Диван угловой Вайвел Barhat Smoke,89 990,В наличии
Диван Бонс-Т Velvet Mint,44 990,В наличии
Диван Викс Textile Sky,21 990,В наличии
Модульный диван Нолан-B 4 Soft Grey,146 450,В наличии
Диван Риббл-11 Bucle Eclipce,83 990,В наличии
Диван угловой Вильен мини Velvet Plum,59 990,В наличии
Диван Кареро Velvet Light,69 990,В наличии
Кушетка Олтен Textile Blue,32 990,В наличии
Модульный диван Нолан-B 1 Soft Yellow,81 980,В наличии
Диван Боско-2 Land Yellow,39 990,В наличии
Модульный диван Риббл-2 Bucle Lilac,128 980,В наличии
Модульный диван Нолан-W 5 Soft Jungle,198 440,В наличии
Диван угловой Биани-1 Barhat Blue,79 990,В наличии
Диван Нумо Мини Textile Silver,24 990,В наличии
Диван Пайпел-3 Bucle Forest,54 990,В наличии
Диван угловой Майнап Velvet Latte,49 990,В наличии
Диван Ольен Мини Velvet Latte,54 990,В наличии
Диван Виенсо Bucle Cloud,79 990,В наличии
Диван Маре Мини Velvet Yellow,27 990,В наличии
Диван угловой Онте Bucle Mint,109 990,В наличии
Диван Лофт Linia Navy Blue,45 990,В наличии
Диван Милкен Velvet Yellow,45 990,В наличии
Диван угловой Льери Barhat Blue,98 990,В наличии
Диван Тут Рядом Космос Светло-Бежевый,109 990,В наличии
Диван Ниса Land Forest,44 990,В наличии
Диван Маркфул Velvet Blue,66 990,В наличии
Модульный диван Риббл-5 Bucle Silver,194 960,В наличии
Диван угловой Динс Velvet Emerald,59 990,В наличии
Диван Сорен Textile Yellow,59 990,В наличии
Диван Тут Рядом Дом Синий,72 990,В наличии
Диван Марей Soft Grey,89 990,В наличии
Диван Саннес Velvet Grey,49 990,В наличии
Диван Динс Мини Velvet Silver,49 990,В наличии
Модульный диван Brera-4 Velour Lilac,161 970,В наличии
Диван Кинси-3 Land Navy Blue,56 990,В наличии
Диван Brera Velour Galaxy,98 990,В наличии
Диван угловой Майнап Velvet Grey,49 990,В наличии
Диван угловой Лилле Velvet Terra,59 990,В наличии
Диван Майнап Velvet Olive,46 990,В наличии
Диван Тут Рядом Дом Серо-графитовый,72 990,В наличии
Кушетка Дилси Textile Silver,37 990,В наличии
Диван Майнап Velvet Grafit,46 990,В наличии
Модульный диван Brera-8 Velour Black,123 970,В наличии
Диван Риббл-7 Bucle Eclipce,51 990,В наличии
Модульный диван Полан-2 Velvet Smoke,93 960,В наличии
Модульный диван Сэндж 1 Textile Yellow,64 970,В наличии
Модульный диван Нолан-W 3 Soft Grafit,114 970,В наличии
Модульный диван Brera-2 Bucle Beige,133 980,В наличии
Диван Хевит Velvet Terra,39 990,В наличии
Модульный диван Риббл-5 Bucle Eclipce,194 960,В наличии
Диван угловой Онте Textile Grey,129 990,В наличии
Диван Порту Textile Light,25 990,В наличии
Модульный диван Brera-8 Velour Stone,123 970,В наличии
Диван Кейсес Velvet Grey,26 990,В наличии
Диван Кела Мини Velvet Mint,39 990,В наличии
Диван угловой Спейс-1 Velvet Grey,69 990,В наличии
Диван угловой Эби-1 Velvet Blue,72 990,В наличии
Диван Риббл-2 Bucle Mint,68 990,В наличии
Модульный диван Brera-2 Velour Cherry,105 980,В наличии
Диван Хевит Velvet Yellow,39 990,В наличии
Диван Кейсес Velvet Navy Blue,26 990,В наличии
Диван Виена Velvet Light,64 990,В наличии
Диван Лесли Velvet Yellow,46 990,В наличии
Диван Бонс-Т Velvet Yellow,44 990,В наличии
Диван Тилар Textile Navy Blue,29 990,В наличии
Диван угловой Амрано Velvet Blue,42 990,В наличии
Диван Лави Velvet Eclipse,43 990,В наличии
Диван угловой Эби-1 Velvet Coral,72 990,В наличии
Диван Риен Velvet Terra,49 990,В наличии
Диван Льери Мини Velvet Coral,64 990,В наличии
Диван угловой Дисент-2 Soft Silver,139 990,В наличии
Диван угловой Дисент-2 Velvet Smoke,109 990,В наличии
Диван Лесли Velvet Red,46 990,В наличии
Диван угловой Харинг Soft Terra,92 990,В наличии
Диван Роттердам-3 Velvet Olive,31 990,В наличии
Модульный диван Нолан-W 3 Soft Yellow,114 970,В наличии
Диван угловой Вайвел Barhat Beige,89 990,В наличии
Диван Милкен Vertical Lavender,45 990,В наличии
Диван угловой Маркфул Velvet Yellow,79 990,В наличии
Диван Ларонсо Soft Blue,84 990,В наличии
Модульный диван Нолан-W 2 Soft Grey,91 470,В наличии
Модульный диван Brera-1 Velour Cinnamon,202 950,В наличии
Диван угловой Шера Velvet Stone,102 990,В наличии
Диван Лачи Velvet Pink,32 990,В наличии
Модульный диван Нолан-B 2 Soft Latte,91 470,В наличии
Модульный диван Риббл-2 Bucle Grafit,128 980,В наличии
Диван Маркфул Velvet Emerald,66 990,В наличии
Модульный диван Риббл-2 Bucle Forest,128 980,В наличии
Диван Brera Velour Cherry,98 990,В наличии
Диван Эрвин-2 Light,30 990,В наличии
Диван угловой Ройн Мини Velvet Smoke,42 990,В наличии
Модульный диван Полан-4 Velvet Ocean,100 960,В наличии
Диван Brera Velour Caramel,98 990,В наличии
Диван Хевит Velvet Beige,39 990,В наличии
Диван Талас Velvet Beige,39 990,В наличии
Диван Роттердам Velvet Beige,25 990,В наличии
Диван Винси Textile Ginger,24 990,В наличии
Диван Слипсон Мини Linia Yellow,44 990,В наличии
Диван Терм Zamsha Olive,89 990,В наличии
Модульный диван Нолан-W 3 Soft Night,114 970,В наличии
Модульный диван Brera-8 Velour Olive,123 970,В наличии
Диван Эрвин-2 Black,30 990,В наличии
Диван Инес Vertical Blue,39 990,В наличии
Диван угловой Льери Barhat Silver,98 990,В наличии
Модульный диван Brera-8 Velour Caramel,123 970,В наличии
Диван угловой Плэнтис Velvet Smoke,98 990,В наличии
Диван Риард-3 Land Light,46 990,В наличии
Модульный диван Нолан-B 4 Soft Grafit,146 450,В наличии
Диван Порту Textile Silver,25 990,В наличии
Диван угловой Мисл-1 Barhat Mint,109 990,В наличии
Диван угловой Слипсон Velvet Stone,66 990,В наличии
Диван Риббл-10 Bucle Grafit,83 990,В наличии
Диван Сорен Textile Plum,59 990,В наличии
Диван угловой Ситено Barhat Blue,69 990,В наличии
Модульный диван Риббл-4 Bucle Eclipce,153 970,В наличии
Диван угловой Биани-2 Barhat Night,98 990,В наличии
Диван Рон Textile Plum,54 990,В наличии
Диван Бонент Velvet Plum,76 990,В наличии
Диван Рейли Velvet Coral,34 990,В наличии
Диван Риард-3 Land Stone,46 990,В наличии
Модульный диван Brera-8 Bucle Beige,156 970,В наличии
Диван Картос Velvet Mint,52 990,В наличии
Диван угловой Эдвин Velvet Smoke,69 990,В наличии
Диван Види Textile Grey,25 990,В наличии
Модульный диван Нолан-W 2 Soft Jungle,91 470,В наличии
Диван Мона Velvet Grey,29 990,В наличии
Диван Кареро Bucle Smoky,82 990,В наличии
Диван Эрвин-2 Red,30 990,В наличии
Диван Пайпел Bucle Beige,49 990,В наличии
Диван Ольен Мини Cozy Ivory,64 990,В наличии
Модульный диван Сэндж 2 Textile Grey,58 970,В наличии
Модульный диван Нолан-B 2 Soft Jungle,91 470,В наличии
Модульный диван Сэндж 3 Textile Ocean,78 960,В наличии
Диван Лави Velvet Pink,43 990,В наличии
Диван Боско-3 Land Forest,49 990,В наличии
Диван Стаус Мини Textile Coral,24 990,В наличии
Модульный диван Сэндж 2 Textile Sky,58 970,В наличии
Диван Спейс-2 Velvet Olive,89 990,В наличии
Модульный диван Риббл-3 Bucle Eclipce,153 970,В наличии
Диван Мейлон Velvet Yellow,47 990,В наличии
Кушетка Манс Velvet Mint,32 990,В наличии
Диван Мира Velvet Olive,43 990,В наличии
Модульный диван Этен Vertical Milk,81 960,В наличии
Диван Лави Velvet Moss,43 990,В наличии
Диван угловой Эби-2 Velvet Olive,98 990,В наличии
Диван Спейс Velvet Terra,64 990,В наличии
Диван угловой Виена Velvet Eclipse,69 990,В наличии
Диван угловой Шера Velvet Terra,102 990,В наличии
Диван Риард-2 Land Light,38 990,В наличии
Диван Леймарк Velvet Wet Sand,49 990,В наличии
Диван Риард-2 Land Black,38 990,В наличии
Диван Види Textile Yellow,25 990,В наличии
Диван Гарди Soft Night,34 990,В наличии
Диван Ситено Barhat Light,59 990,В наличии
Кушетка Дилси Textile Yellow,37 990,В наличии
Диван Картос Velvet Olive,52 990,В наличии
Диван Маркфул Velvet Light,66 990,В наличии
Диван Ларонсо Textile Grafit,89 990,В наличии
Диван Сваут Velvet Terra,66 990,В наличии
Диван угловой Лаберт Barhat Beige,109 990,В наличии
Диван угловой Дисент-1 Soft Jungle,96 990,В наличии
Модульный диван Нолан-W 3 Soft Latte,114 970,В наличии
Диван Инес Vertical Light,39 990,В наличии
Кушетка Тут Рядом Космос Синий,89 990,В наличии
Диван Ситено Barhat Ginger,59 990,В наличии
Диван Саннес Velvet Mint,49 990,В наличии
Диван Риббл-7 Bucle Forest,51 990,В наличии
Диван угловой Бруквиль Velvet Terra,59 990,В наличии
Диван Коренс-3 Happy Mint,35 990,В наличии
Диван угловой Лаберт Barhat Grafit,109 990,В наличии
Диван угловой Нордика мини Velvet Light,59 990,В наличии
Модульный диван Нолан-B 2 Soft Yellow,91 470,В наличии
Модульный диван Риббл-5 Bucle Mint,194 960,В наличии
Кушетка Норфолк Velvet Mint,25 990,В наличии
Кушетка Берил Velvet Coral,35 990,В наличии
Диван угловой Аллаум Linia Beige,52 990,В наличии
Диван Роттердам Velvet Violet,25 990,В наличии
Модульный диван Нолан-W 3 Soft Jungle,114 970,В наличии
Диван Риббл-7 Bucle Mint,51 990,В наличии
Диван Риард-3 Land Forest,46 990,В наличии
Диван Риббл-1 Bucle Lilac,68 990,В наличии
Диван Сваут Velvet Moss,66 990,В наличии
Диван угловой Маркфул Velvet Coral,79 990,В наличии
Диван угловой Бонент Velvet Light,92 990,В наличии
Диван угловой Спейс-2 Velvet Olive,98 990,В наличии
Диван угловой Мисл-1 Barhat Stone,109 990,В наличии
Диван угловой Беллер Textile Navy Blue,43 990,В наличии
Диван Кейсес Velvet Olive,26 990,В наличии
Диван угловой Эби-2 Velvet Grey,98 990,В наличии
Диван Коренс Happy Mint,30 990,В наличии
Модульный диван Нолан-B 5 Soft Latte,198 440,В наличии
Диван Риббл-1 Bucle Eclipce,68 990,В наличии
Модульный диван Нолан-B 1 Soft Jungle,81 980,В наличии
Диван Кинси-2 Land Navy Blue,49 990,В наличии
Диван Ларонсо Soft Silver,84 990,В наличии
Диван угловой Онте Bucle Eclipse,109 990,В наличии
Диван угловой Вайвел Barhat Forest,89 990,В наличии
Диван Маркфул Velvet Grey,66 990,В наличии
Диван Мира Velvet Latte,43 990,В наличии
Диван угловой Харинг Soft Jungle,92 990,В наличии
Диван угловой Нумо Velvet Light,47 990,В наличии
Диван угловой Мейлон Velvet Olive,49 990,В наличии
Диван Роттердам-3 Velvet Silver,31 990,В наличии
Диван Данста Velvet Mint,66 990,В наличии
Модульный диван Этен 3 Vertical Terra,140 940,В наличии
Диван Рейли Velvet Silver,34 990,В наличии
Диван Динс Velvet Silver,54 990,В наличии
Диван Тилар Cozy Milk,29 990,В наличии
Диван Стаус Мини Textile Light,24 990,В наличии
Диван угловой Ситено Barhat Mint,69 990,В наличии
Модульный диван Нолан-W 3 Soft Milk,114 970,В наличии
Модульный диван Полан-4 Velvet Light,100 960,В наличии
Диван Арклоу Soft Blue,56 990,В наличии
Модульный диван Brera-2 Velour Olive,105 980,В наличии
Диван Лачи Velvet Navy Blue,32 990,В наличии
Диван угловой Биани-2 Barhat Beige,98 990,В наличии
Диван Лейсон Velvet Yellow,49 990,В наличии
Диван угловой Дисент-2 Soft Ginger,139 990,В наличии
Диван Терм Velvet Beige,69 990,В наличии
Модульный диван Этен 5 Vertical Terra,77 960,В наличии
Диван угловой Динс Velvet Milk,59 990,В наличии
Диван Нумо Velvet Pink,37 990,В наличии
Диван Рон Textile Ocean,54 990,В наличии
Диван угловой Лилле Velvet Atlantic,59 990,В наличии
Диван угловой Эдвин Velvet Stone,69 990,В наличии
Диван Мейлон Velvet Stone,47 990,В наличии
Диван Линс Velvet Yellow,34 990,В наличии
Диван Бонент Velvet Grey,76 990,В наличии
Модульный диван Риббл-5 Bucle Grafit,194 960,В наличии
Диван угловой Вайвел Barhat Night,89 990,В наличии
Диван Хевит Velvet Smoke,39 990,В наличии
Модульный диван Нолан-B 1 Soft Latte,81 980,В наличии
Кушетка Ринт Bucle Forest,20 990,В наличии
Диван Эби Мини Linia Stone,56 990,В наличии
Модульный диван Нолан-W 1 Soft Yellow,81 980,В наличии
Модульный диван Brera-4 Velour Beige,161 970,В наличии
Диван угловой Льери Мини Velvet Emerald,69 990,В наличии
Диван угловой Ройн Мини Velvet Pink,42 990,В наличии
Модульный диван Brera-7 Velour Forest,177 970,В наличии
Диван Кела Мини Velvet Navy Blue,39 990,В наличии
Диван Маркфул Velvet Ocean,66 990,В наличии
Диван угловой Порту Textile Brown,32 990,В наличии
Диван угловой Бруквиль Velvet Blue,59 990,В наличии
Диван Аркет-2 Velvet Smoke,34 990,В наличии
Диван угловой Ситено Barhat Ginger,69 990,В наличии
