name,price
Диван Байвин Soft Latte,0
Диван угловой Монти 156,0
Диван угловой Лофт Velvet Green,0
Диван Старк 160 Velvet Yellow,0
Диван Милкен Textile Cream,0
Кушетка Дилси Barhat Umber,0
Диван Айверс Textile Ocean,0
Диван Эби Happy Grafit,0
Диван Торонто Velvet Light,0
Диван Орнен Velvet Beige,0
Диван Этро Velvet Blue,0
Модульный диван Риббл-3 Bucle Blue,0
Диван Милкен Smart Tango,0
Диван Мурано Velvet Grey,0
Диван Мисл Barhat Melon,0
Диван Сайле Barhat Blue,0
Диван угловой Монти 155,0
Диван Аруби Velvet Grey,0
Диван Динс Мини Velvet Yellow,0
Диван Дания-3 Barhat Grey,0
Диван Роден-3 Red,0
Диван Вернон 160 Velvet Light,0
Диван угловой Байвин-1 Soft Ocean,0
Диван Ситено Velvet Light,0
Диван Мона Barhat Grey,0
Диван Винси Textile Grafit,0
Диван Велайт Barhat Ocean,0
Модульный диван Динс Textile Blue,0
Диван Плиди Happy Emerald,0
Диван Сите-3 Barhat Rain,0
Модульный диван Монреаль-1 Палермо Navy Blue,0
Диван угловой Байвин-1 Soft Light,0
Диван Марси Velvet Blue,0
Модульное кресло Полан Velvet Pink,0
Диван Фида Velvet Grafit,0
Диван Эрвика Velvet Terra,0
Модульный диван Монреаль-1 Zamsha Brown,0
Диван Эвора 128,0
Диван Ваймон Velvet Mint,0
Диван Лофт Velvet Yellow,0
Диван Берг Velvet Grey,0
Кушетка Норфолк Barhat Grey,0
Диван Кареро Velvet Atlantic,0
Диван Кела Мини Velvet Light,0
Диван Котн Textile Brown,0
Диван угловой Амрано Velvet Blue,0
Диван Кита Textile Sky,0
Диван Мисл Barhat Salmon,0
Диван Монти 157/1,0
Диван Медиус-2 White,0
Кушетка Ситено Barhat Amber,0
Диван угловой Слипсон Grey,0
Модульный диван Этен 4 Gene Grafit,0
Диван Орнен Barhat Rose,0
Диван угловой Менли Velvet Light,0
Диван Маре Мини Velvet Yellow old,0
Модульный диван Динс Sherst Grey,0
Кушетка Балтик Textile Grey,0
Диван Фида Velvet Navy Blue,0
Диван Спейс Soft Ocean,0
Диван угловой Джерси Velvet Ocean,0
Диван Вероли Velvet Grafit,0
Диван угловой Дисент-2 Velvet Eclipse,0
Диван угловой Слипсон Emerald,0
Кушетка Магни Textile Light,0
Диван Офра Happy Mint,0
Диван угловой Сайле Barhat Blue,0
Диван Нумо Мини Time Pink,0
Диван угловой Ситено Barhat Emerald,0
Диван угловой Эби-2 Happy Grey,0
Диван угловой Дарол Time Blue,0
Диван Плиди Happy Mint,0
Модульный диван Этен 1 Vertical Mix new,0
Диван угловой Мейсон Lime,0
Диван угловой Милбург Textile Beige,0
Диван Лачи Velvet Grey,0
Диван Плиди Velvet Crimson,0
Диван Ридан Barhat Stone,0
Модульный диван Винсор-2 Velvet Beige,0
Диван Мисл Buffalo Brown,0
Диван Линкольн White,0
Кушетка Норфолк Velvet Grey,0
Кушетка Форни Barhat Salmon,0
Диван Ридан Barhat Emerald,0
Диван Виас Velvet Grafit,0
Диван угловой Байвин-1 Soft Latte,0
Диван Китис Velvet Yellow,0
Диван Этро Velvet Beige,0
Диван Шери Happy Grafit,0
Диван Динен Velvet Navy Blue,0
Диван Ситено Мини Velvet Silver,0
Диван угловой Мидгард Textile Cream,0
Диван Миннесота Textile Grey,0
Диван Гритон Textile Beige,0
Модульный диван Этен 3 Vertical Light,0
Диван Вероли Velvet Light,0
Диван Напа Velvet Ocean,0
Диван Винси Textile Ocean,0
Диван угловой Эби-1 Happy Grey,0
Диван угловой Монти 157/1,0
Диван Лофт Linia Emerald,0
Модульный диван Полан-3 Velvet Mint,0
Кушетка Манс Barhat Umber,0
Кушетка Мона Barhat Green,0
Диван Сите-2 Barhat Grey,0
Диван угловой Дисент-2 Velvet Emerald,0
Диван Марси Velvet Yellow,0
Диван Ситено Barhat Mint,0
Диван Мейсон Velvet Emerald,0
Диван Сайле Smart SkyFall,0
Кушетка Норфолк Velvet Pink,0
Диван угловой Санту-1 Textile Grafit,0
Диван Роден-3 White,0
Диван Динен Soft Mint,0
Модульный диван Монреаль-3 Zamsha Grey,0
Диван Кускен Smart Blue,0
Диван Крокус-3 Latte,0
Диван Сайле Soft Navy Blue,0
Диван Ольен Vertical Jeans,0
Диван Хоуп Velvet Crimson,0
Диван Ганновер Rozetta,0
Модульное кресло Полан Velvet Cloud Grey,0
Модульный диван Винсор-2 Velvet Gold,0
Диван угловой Саффолк Velvet Blue,0
Диван Анта Velvet Blue,0
Диван угловой Ситено Time Salmon,0
Диван Менли Velvet Latte,0
Диван Плиди Happy Light,0
Диван Милкен Textile Grey,0
Диван Шарп 160 Happy Yellow,0
Диван Стокгольм 212,0
Диван Динен Velvet Emerald,0
Диван Ваймон Velvet Plum,0
Диван угловой Санту-2 Textile Grey,0
Диван Роттердам Velvet Green,0
Диван угловой Манхэттен Velvet Grey,0
Модульный диван Динс-1 Velvet Light,0
Диван Менли Velvet Navy Blue,0
Диван Стокгольм 211,0
Диван Белисса Velvet Emerald,0
Модульный диван Динс Velvet Olive,0
Диван Самми Barhat Mint,0
Диван Лекстон Velvet Navy Blue,0
Диван Каир Velvet Green,0
Диван угловой Монсо Happy Grafit,0
Диван Сваут Barhat Blue,0
Диван Честер-3 Sherst Sky,0
Диван угловой Ротшильд Light,0
Диван Динс Мини Velvet Pink,0
Диван Ксанти Happy Grey,0
Диван Марси Velvet Beige,0
Диван угловой Манхэттен Velvet Crimson,0
Модульный диван Динс Velvet Grey,0
Модульный диван Этен 2 Vertical Mix new,0
Диван Льери Velvet Grey,0
Диван Айверс Textile Green,0
Диван Орнен Velvet Corall,0
Диван Остин 160 Velvet Yellow,0
Диван угловой Мейсон Velvet Blue,0
Модульный диван Динс Velvet Emerald,0
Диван угловой Плэнтис Velvet Eclipse,0
Диван Бастон-3 Grey,0
Диван Сан-Паулу Velvet Latte,0
Диван Анта Velvet Grey,0
Диван Динен Velvet Grey,0
Кушетка Манс Barhat Salmon,0
Диван Орнен Velvet Blue,0
Диван угловой Ситено Velvet Ocean,0
Диван Тилар Cozy White,0
Модульный диван Монреаль-1 Палермо Gris,0
Диван Берг Lozenge Green,0
Диван угловой Эдинбург Beige,0
Диван Джуна Velvet Grey,0
Диван Динен Velvet Grafit,0
Модульный диван Монреаль-2 Премиум Barhat Mint,0
Кушетка Форни Barhat Ocean,0
Диван Остин Velvet Grey,0
Диван Масио Velvet Coral,0
Диван Виена Velvet Atlantic,0
Диван Мисл Soft Grey,0
Диван Честер-2 Sherst Sky,0
Диван Мурано 160 Velvet Latte,0
Диван угловой Сваут Velvet Light,0
Диван Ольен Мини Happy Ocean,0
Диван Кела Мини Velvet Milk,0
Диван Крокус-2 White,0
Диван Вернон Velvet Grey,0
Диван Ксанти Happy Ocean,0
Диван Мейсон Velvet Light Grey,0
Кушетка Магни Red,0
Диван Динен Velvet Ocean,0
Диван угловой Мейсон Light,0
Диван угловой Инарт Happy Grafit,0
Диван Эрвика Velvet Yellow,0
Диван угловой Медиус Latte,0
Диван Эби Мини Happy Mint,0
Модульный диван Монреаль-3 Ocean,0
Диван Шенто Barhat Grey,0
Диван Динен Velvet Beige,0
Диван угловой Сваут Velvet Emerald,0
Модульный диван Монреаль-4 Премиум Barhat Grey,0
Диван Бонс Textile Ocean,0
Диван Байвин Soft Grey,0
Кушетка Мона Barhat Latte,0
Диван Дисент Land Forest,0
Диван Ваймон Velvet Yellow,0
Диван угловой Лофт Velvet Grafit,0
Диван Бриес Barhat Mint,0
Диван Милкен Velvet Lime,0
Диван угловой Мейсон Yellow,0
Диван Лачи Velvet Ocean,0
Диван Орнен Barhat Sky,0
Диван Бриес Barhat Blue,0
Диван угловой Торин Navy Blue,0
Диван Анта Barhat Emerald,0
Диван Бастон-3 Brown,0
Диван Старк Velvet Cocoa,0
Диван Вернон Velvet Light,0
Диван Рузвельт Pearl,0
Диван угловой Торин Dusty Blue,0
Диван Роден-2 Beige,0
Диван Нодис Happy Deep Ocean,0
Диван Мона Barhat Latte,0
Диван Бастон-2 Grey,0
Диван Ротшильд Latte,0
Диван угловой Напа Velvet Blue,0
Диван угловой Менли Velvet Latte,0
Диван угловой Байвин-2 Soft Grey,0
Диван Виена Bucle Milk,0
Диван Котн Textile Grey,0
Диван Сайле Soft Ocean,0
Диван Фида Velvet Emerald,0
Диван Ридан Barhat Gold,0
Диван Фида Velvet Yellow,0
Диван Масио 160 Velvet Coral,0
Кушетка Балио Velvet Pink,0
Диван Дисент Velvet Eclipse,0
Диван Бонс-Т Happy Emerald,0
Диван Мона Barhat Amber,0
Диван Мисл Happy Ocean,0
Диван Виена Velvet Deep Ocean,0
Кушетка Эдрил Velvet Grey,0
Диван Илар Velvet Pink,0
Диван угловой Байвин-1 Soft Olive,0
Диван Банта Bucle White,0
Диван угловой Милбург Textile Blue,0
Диван Лориш Grey,0
Диван Санту Textile Beige,0
Модульный диван Полан-1 Velvet Coral,0
Диван угловой Ситено Time Blue,0
Диван Ольен Happy Ocean,0
Диван Плиди Happy Grafit,0
Кушетка Норфолк Velvet Latte,0
Кушетка Форни Barhat Latte,0
Диван Рузвельт Lavender,0
Модульный диван Монреаль-4 Zamsha Grey,0
Диван Офра Happy Yellow,0
Диван Фолс 160 Velvet Mustard,0
Диван Карлос-3 Latte,0
Диван угловой Льери Velvet Yellow,0
Диван Нумо Мини Time Mint,0
Диван угловой Санту-1 Textile Ocean,0
Диван Дублин Happy Grey,0
Кушетка Норфолк Velvet Green,0
Диван Соланс Velvet Terra,0
Диван Дисент Velvet Terra,0
Диван Шарп Velvet Mint,0
Модульный диван Динс-2 Sherst Sky,0
Диван Ксанти Happy Mint,0
Диван Сите-2 Barhat Rain,0
Диван Динс Chess Black,0
Диван угловой Льери Barhat Blue,0
Диван Мейсон Velvet Plum,0
Модульный диван Монреаль-2 Zamsha Brown,0
Диван Кускен Smart SkyFall,0
Диван Дублин-3 Happy Yellow,0
Диван Ситено Time Salmon,0
Диван Лориш Beige,0
Диван Сан-Паулу Velvet Light,0
Диван Гритон Textile Grey,0
Диван Старк 160 Velvet Brown,0
Диван Эрвика Velvet Grey,0
Диван Дисент Velvet Stone,0
Диван Белисса Velvet Ocean,0
Модульный диван Полан-2 Velvet Cloud Grey,0
Диван Самми Barhat Blue,0
Кушетка Норфолк Sherst Grey,0
Диван Крокус-3 Black,0
Кушетка Норфолк Sherst Blue,0
Диван Роттердам-3 Tesla Grey,0
Диван Миннесота Textile Beige,0
Модульный диван Динс-1 Velvet Olive,0
Диван Виас Velvet Grey,0
Диван Шенто Barhat Ginger,0
Диван угловой Корс Velvet Emerald,0
Диван Маре Мини Velvet Beige,0
Кушетка Лори Textile Blue,0
Диван угловой Мисл-1 Barhat Salmon,0
Модульный диван Динс-1 Sherst Grey,0
Диван Мейсон Velvet Ocean,0
Кушетка Эдрил Velvet Latte,0
Диван Динс Мини Velvet Corall,0
Диван Санту Textile Grey,0
Диван Шилдс Happy Light,0
Диван Масио 160 Velvet Ocean,0
Диван Китис Velvet Navy,0
Диван угловой Льери Velvet Light,0
Кушетка Астер-3 Textile Blue,0
Диван Лисмос Ocean,0
Диван Виена Velvet Eclipse,0
Кушетка Динс Velvet Yellow,0
Диван Илар Velvet Grafit,0
Диван угловой Эби-1 Happy Emerald,0
Диван Масио 160 Velvet Light Grey,0
Диван Вернон 160 Velvet Grey,0
Диван угловой Менли Velvet Navy Blue,0
Диван Торонто 160 Velvet Mint,0
Модульный диван Полан-2 Velvet Green,0
Диван Напа Velvet Grey,0
Диван угловой Сваут Velvet Grey,0
Диван Динс Textile Ocean,0
Диван угловой Верона Barhat Mint,0
Диван Ганновер Luna,0
Кушетка Дилси Barhat Rain,0
Диван Ваймон Velvet Beige,0
Диван Динен Velvet Yellow,0
Кушетка Магни Textile Grafit,0
Модульный диван Монреаль-1 Премиум Barhat Mint,0
Диван Эби Happy Bear,0
Диван угловой Инарт Happy Ocean,0
Диван Банта Bucle Lilac,0
Диван Масио Velvet Ocean,0
Диван угловой Гритон Textile Grey,0
Диван Винси Textile Yellow,0
Диван Ридан Barhat Marsala,0
Диван Лоелс Honey Yellow,0
Диван Рузвельт Blue,0
Диван Бастон-3 Black,0
Диван Саннес Textile Coral,0
Диван Честер-2 Velvet Latte,0
Диван угловой Лофт Velvet Latte,0
Диван Винси Soft Latte,0
Диван Старк Velvet Grey,0
Диван Брент Velvet Atlantic,0
Диван Ольен Happy Emerald,0
Модульный диван Монреаль-2 Палермо Mustard,0
Диван Монти 158/1,0
Кушетка Магни Textile Blue,0
Кушетка Магни Textile Grey,0
Диван Роттердам Velvet Blue,0
Диван угловой Дарол Time Grey,0
Кушетка Балтик Textile Grey,0
Диван Флори Textile Plum,0
Диван Коро Velvet Coral,0
Диван Коро Velvet Beige,0
Модульный диван Монреаль-1 Grafit,0
Диван Дель Velvet Crimson,0
Диван угловой Ситено Velvet Light,0
Диван Лоелс Happy Yellow,0
Диван Порту Textile Latte,0
Диван Кита Textile Ocean,0
Диван Мурано 160 Velvet Grafit,0
Кушетка Балтик Textile Grafit,0
Диван Дисент Velvet Light,0
Диван Орнен Barhat Marsala,0
Диван Нумо Time Brown,0
Диван Шарп 160 Velvet Blue,0
Диван Кайрон Velvet Grey,0
Диван Лайтси Velvet Emerald,0
Диван Монреаль Палермо Gris,0
Диван Монреаль Премиум Barhat Mint,0
Модульный диван Винсор-1 Velvet Gold,0
Диван угловой Санту-2 Textile Plum,0
Диван угловой Эби-1 Happy Mint,0
Диван угловой Лофт Navy Blue,0
Диван Кускен Vertiсal Ocean,0
Кушетка Астер Textile Grey,0
Диван Торонто Velvet Grey,0
Диван Роден-2 Red,0
Диван Лиент Velvet Grafit,0
Диван Дания-3 Barhat Salmon,0
Диван Льери Мини Velvet Terra,0
Модульный диван Динс-1 Velvet Navy Blue,0
Диван угловой Спейс-2 Soft Yellow,0
Диван Динс Textile Light,0
Диван Ларонсо Velvet Light,0
Диван Эвора 116,0
Диван угловой Ситено Barhat Grey,0
Диван Лайтси Velvet Navy Blue,0
Диван Берг Velvet Yellow,0
Диван Слипсон Emerald,0
Диван Ситено Мини Barhat Umber,0
Диван угловой Милбург Textile Silver,0
Диван Марси Velvet Silver,0
Диван Ридан Infinity Blue,0
Диван Льери Velvet Light,0
Диван Сайле Barhat Salmon,0
Диван Роден-2 White,0
Диван Сите-2 Barhat Olive,0
Диван Коренс Happy Ocean,0
Диван Артилс Velvet Yellow,0
Диван Лофт Linia Vanil,0
Диван Крокус-2 Black,0
Диван угловой Маркфул Barhat Blue,0
Диван Саннес Textile Ocean,0
Диван Мона Barhat Olive,0
Диван Рузвельт Black,0
Кушетка Мона Barhat Blue,0
Диван Дель Velvet Emerald,0
Диван Лоелс Happy Grafit,0
Диван Ситено Barhat Grey,0
Диван Кайрон Velvet Emerald,0
Диван Торонто 160 Velvet Brown,0
Диван Честер-3 Lambre Grey,0
Диван Виена Velvet Grey,0
Диван Роттердам-3 Velvet Lime,0
Кушетка Дилси Barhat Ocean,0
Диван Шарп 160 Velvet Beige,0
Диван Ротшильд Brown,0
Диван Роттердам Velvet Lime,0
Диван Анта Velvet Pink,0
Диван угловой Гритон Textile Yellow,0
Диван Роден-3 Brown,0
Диван Сайле Soft Olive,0
Диван Ольен Мини Happy Grafit,0
Кушетка Балтик Textile Blue,0
Диван угловой Онте Bucle Beige,0
Диван Аруби Velvet Mustard,0
Модульный диван Монреаль-2 Палермо Navy Blue,0
Диван Маркфул Barhat Emerald,0
Диван угловой Аиленд Soft Navy Blue,0
Диван угловой Монти 160,0
Диван Лайтси Velvet Yellow,0
Кушетка Динс Sherst Grey,0
Модульный диван Монреаль-1 Zamsha Grey,0
Модульный диван Риббл-1 Bucle White,0
Диван угловой Джоин Velvet Grey,0
Диван Лоелс Happy Grey,0
Диван угловой Дарол Gene Grafit,0
Диван угловой Медиус Black,0
Диван Масио Velvet Grey,0
Диван Кела Мини Velvet Yellow,0
Диван Дублин Happy Ocean,0
Диван Ганновер Light,0
Диван Спейс Soft Grey,0
Диван Эрвика Velvet Atlantic,0
Диван Эвора 129,0
Диван угловой Манхэттен Velvet Black,0
Диван угловой Инарт Happy Grey,0
Диван Офра Happy Deep Ocean,0
Диван угловой Медиус White,0
Диван Фолс Velvet Coral,0
Диван Эби Buffalo Brown,0
Диван Нодис Happy Grafit,0
Кушетка Динс Textile Light,0
Модульный диван Полан-5 Velvet Green,0
Диван Слипсон Chess Black,0
Диван Лекстон Velvet Latte,0
Диван Остин 160 Velvet Brown,0
Диван Мисл Barhat Light,0
Модульный диван Крокус-2 White,0
Модульный диван Риббл-4 Bucle White,0
Модульный диван Крокус-1 White,0
Диван угловой Эби-1 Happy Ocean,0
Кушетка Мона Barhat Olive,0
Диван Белисса Velvet Grey,0
Диван угловой Слипсон Happy Light,0
Модульный диван Монреаль-3 Премиум Barhat Grey,0
Диван Стаус Velvet Grafit,0
Диван Дания-2 Barhat Rain,0
Диван Лофт Buffalo Brown,0
Диван Гритон Мини Textile Ocean,0
Диван Вилс Black,0
Диван Шери Happy Yellow,0
Диван Осло-2 Black,0
Диван Эдрил Barhat Mint,0
Диван Напа Velvet Mustard,0
Модульный диван Монреаль-3 Палермо Mustard,0
Модульный диван Риббл-1 Bucle Violet,0
Диван Честер-2 Barhat Salmon,0
Диван угловой Аиленд Soft Grey,0
Модульный диван Этен 4 Vertical Light,0
Диван Порту Textile Blue,0
Модульный диван Полан-3 Velvet Coral,0
Диван Лени Velvet Latte,0
Диван Самми Barhat Amber,0
Диван Реджио Soft Ocean,0
Кушетка Летто Textile Coral,0
Кушетка Балтик Textile Yellow,0
Диван Менли Velvet Light,0
Диван Марси Velvet Navy Blue,0
Диван Хевит Barhat Yellow,0
Диван Флори Textile Beige,0
Диван Лофт Gene Grafit,0
Модульный диван Динс-2 Velvet Yellow,0
Диван угловой Аиленд Soft Olive,0
Кушетка Летто Textile Grey,0
Диван угловой Онте Bucle Grafit,0
Диван Дисент Bucle White,0
Диван угловой Лориш Yellow,0
Диван Ридан Barhat Beige,0
Модульный диван Монреаль-2 Премиум Barhat Grey,0
Диван Шери Happy Ocean,0
Диван Вилс Lime,0
Кушетка Балтик Textile Coral,0
Диван Марси Velvet Milk,0
Диван угловой Монсо Happy Ocean,0
Диван Лилле Velvet Light,0
Диван Монреаль Премиум Barhat Blue,0
Диван Слипсон Мини Time Grey,0
Диван угловой Амрано Velvet Pink,0
Диван Роттердам Cozy White,0
Диван Верона Barhat Mint,0
Диван Роден-3 Beige,0
Диван Рон Textile Ocean,0
Диван Марси Velvet Grafit,0
Диван Стаус Velvet Yellow,0
Диван угловой Динс Textile Ocean,0
Модульный диван Риббл-4 Bucle Violet,0
Диван угловой Мурано Velvet Grafit,0
Диван Джуна Velvet Ocean,0
Диван Динс Мини Velvet Beige,0
Диван Менли Velvet Grey,0
Диван Мурано Velvet Grafit,0
Модульный диван Динс-2 Textile Blue,0
Диван Ольен Мини Happy Bear,0
Диван Динен Velvet Olive,0
Диван Дублин Happy Yellow,0
Диван Роттердам Velvet Yellow,0
Диван Дель Velvet Grey,0
Диван Монти 156,0
Диван Мона Barhat Salmon,0
Модульный диван Динс Textile Ocean,0
Диван Старк Velvet Brown,0
Диван Эби Happy Ocean,0
Модульный диван Полан-2 Velvet Beige,0
Диван Стаус Velvet Emerald,0
Диван Эби Мини Time Light,0
Диван угловой Мисл-1 Barhat Gold,0
Диван угловой Ротшильд Nero,0
Модульный диван Монреаль-1 Премиум Barhat Blue,0
Диван Марси Textile Sky,0
Диван Льери Barhat Emerald,0
Диван Аруби Velvet Emerald,0
Диван Шенто Gene Forest,0
Диван Джуна Velvet Milk,0
Диван угловой Монсо Happy Grey,0
Диван Спейс Soft Beige,0
Кушетка Манс Barhat Beige,0
Диван угловой Мидгард Textile Ocean,0
Диван угловой Напа Velvet Silver,0
Диван Самми Barhat Grey,0
Диван Сан-Паулу Velvet Yellow,0
Диван Байвин Soft Ocean,0
Диван угловой Манхэттен Velvet Milk,0
Диван Ридан Barhat Rose,0
Диван Артилс Velvet Latte,0
Диван Аруби Velvet Beige,0
Диван Кайли Velvet Coral,0
Диван угловой Байвин-2 Soft Navy Blue,0
Диван Флори Textile Yellow,0
Модульный диван Полан-2 Velvet Mint,0
Модульный диван Полан-3 Velvet Provance,0
Кушетка Ситено Barhat Grey,0
Диван Ольен Мини Happy Yellow,0
Диван угловой Монсо Happy Latte,0
Диван Роттердам Barhat Mint,0
Диван Ларонсо Velvet Grey,0
Диван угловой Дисент-2 Land Forest,0
Кушетка Астер-3 Textile Grey,0
Диван Карлос-2 Brown,0
Диван Эби Мини Time Yellow,0
Диван Гритон Мини Textile Yellow,0
Модульный диван Полан-2 Velvet Provance,0
Диван Дара Happy Latte,0
Диван угловой Манхэттен Velvet Latte,0
Диван угловой Астер Textile Latte,0
Диван угловой Дисент-2 Velvet Stone,0
Кушетка Норфолк Time Navy Blue,0
Диван Сите-3 Barhat Salmon,0
Диван угловой Санту-2 Textile Yellow,0
Диван Марси Chess Black,0
Диван Иноле Soft Ocean,0
Диван угловой Нумо Time Blue,0
Диван Каир Textile Latte,0
Диван Данста Velvet Grafit,0
Диван угловой Динс Velvet Grey,0
Диван угловой Ситено Barhat Amber,0
Диван Шарп Velvet Light,0
Диван Эннис Textile Cream,0
Диван Стаус Velvet Mint,0
Кушетка Астер Textile Latte,0
Диван угловой Спейс-1 Soft Yellow,0
Диван угловой Виена Velvet Emerald,0
Диван угловой Менли Velvet Yellow,0
Диван Велайт Velvet Grey,0
Диван Марси Velvet Olive,0
Диван Джуна Velvet Pink,0
Диван угловой Сваут Barhat Blue,0
Диван угловой Ситено Barhat Gold,0
Диван Эби Мини Linia Ginger,0
Диван угловой Манхэттен Textile Grey,0
