name,price,exist
Диван угловой Биани-2 Cozy Ivory,119 990,В наличии
Кушетка Тут Рядом Космос Зеленый,89 990,В наличии
Диван Маре Мини Velvet Grafit,27 990,В наличии
Диван Роттердам-3 Cozy Milk,34 990,В наличии
Диван Соланс Velvet Sand,29 990,В наличии
Диван угловой Бонент Velvet Terra,92 990,В наличии
Диван Тилар Textile Yellow,29 990,В наличии
Диван Викс Textile Yellow,21 990,В наличии
Диван Эби Velvet Smoke,64 990,В наличии
Диван угловой Биани-1 Barhat Night,79 990,В наличии
Диван Кинси-2 Land Light,49 990,В наличии
Диван угловой Шера Velvet Grey,102 990,В наличии
Диван Лейсон Velvet Blue,49 990,В наличии
Диван Риббл-11 Bucle Grafit,83 990,В наличии
Модульный диван Этен 1 Vertical Milk,115 950,В наличии
Диван Нумо Velvet Green,37 990,В наличии
Диван Дара Velvet Latte,44 990,В наличии
Диван Марей Soft Latte,89 990,В наличии
Диван Эрвин-2 White,30 990,В наличии
Модульный диван Сэндж 1 Textile Grey,64 970,В наличии
Диван Соланс Velvet Blue,29 990,В наличии
Диван угловой Харинг Soft Toffe,92 990,В наличии
Диван Лонди Cozy Ginger,52 990,В наличии
Кушетка Дилси Textile Light,37 990,В наличии
Диван угловой Виллес Velvet Smoke,56 990,В наличии
Диван Бонент Velvet Moss,76 990,В наличии
Диван угловой Сайле Barhat Stone,139 990,В наличии
Диван Тут Рядом Космос Графитовый,109 990,В наличии
Диван Гарди Soft Toffe,34 990,В наличии
Диван угловой Аронт Мини Velvet Pink,58 990,В наличии
Диван Риббл-2 Bucle Grafit,68 990,В наличии
Модульный диван Сэндж 3 Textile Yellow,78 960,В наличии
Модульный диван Нолан-B 5 Soft Yellow,198 440,В наличии
Кушетка Интори Soft Yellow,28 990,В наличии
Диван Риббл-1 Bucle Grafit,68 990,В наличии
Диван угловой Эби-2 Velvet Smoke,98 990,В наличии
Диван угловой Ларонсо Soft Terra,109 990,В наличии
Диван Слипсон Мини Linia Stone,44 990,В наличии
Диван Роттердам Velvet Silver,25 990,В наличии
Диван Майнап Velvet Latte,46 990,В наличии
Диван Виена Velvet Corall,64 990,В наличии
Кушетка Кото Cozy Dove,46 990,В наличии
Диван Сваут Velvet Emerald,66 990,В наличии
Диван Линс Velvet Latte,34 990,В наличии
Диван угловой Аронт Мини Velvet Smoke,58 990,В наличии
Модульный диван Нолан-W 4 Soft Grafit,146 450,В наличии
Модульный диван Нолан-B 3 Soft Night,114 970,В наличии
Диван угловой Вайвел Barhat Caramel,89 990,В наличии
Диван Биани Cozy Ivory,89 990,В наличии
Модульный диван Полан-2 Velvet Terra,93 960,В наличии
Диван угловой Аронт Мини Velvet Olive,58 990,В наличии
Модульный диван Риббл-1 Bucle Silver,76 980,В наличии
Диван Тут Рядом Дом Желтый,72 990,В наличии
Диван Сите-2 Velvet Smoke,32 990,В наличии
Модульный диван Этен 6 Vertical Mint,82 960,В наличии
Кушетка Венето Velvet Green,38 990,В наличии
Диван Эби Velvet Grey,64 990,В наличии
Диван Ситено Barhat Emerald,59 990,В наличии
Диван угловой Беллер Textile Light,43 990,В наличии
Диван Талас Velvet Smoke,39 990,В наличии
Диван угловой Дисент-1 Soft Grey,96 990,В наличии
Диван Риббл-2 Bucle Forest,68 990,В наличии
Диван Стаус Velvet Caramel,30 990,В наличии
Диван Инес Vertical Grey,39 990,В наличии
Модульный диван Полан-2 Velvet Ocean,93 960,В наличии
Диван Лонди Cozy Ivory,52 990,В наличии
Диван Линс Velvet Emerald,34 990,В наличии
Модульный диван Этен 2 Vertical Jeance,149 940,В наличии
Модульный диван Полан-3 Velvet Caramel,72 960,В наличии
Диван Эрвин-3 Brown,38 990,В наличии
Диван Пайпел-3 Bucle Grafit,54 990,В наличии
Диван угловой Майнап Velvet Yellow,49 990,В наличии
Диван угловой Слипсон Velvet Milk,66 990,В наличии
Диван угловой Вильен мини Velvet Smoke,59 990,В наличии
Диван угловой Льери Мини Velvet Coral,69 990,В наличии
Диван Бонент Velvet Smoke,76 990,В наличии
Кушетка Оренте Soft Yellow,46 990,В наличии
Диван угловой Лаберт Barhat Blue,109 990,В наличии
Диван угловой Сайле Barhat Light,139 990,В наличии
Диван Лонди Mima Pink,89 990,В наличии
Модульный диван Полан-5 Velvet Smoke,127 950,В наличии
Диван Лилле Velvet Light,49 990,В наличии
Модульный диван Brera-1 Velour Caramel,202 950,В наличии
Диван Эрвин-3 Red,38 990,В наличии
Диван Сторм Land Milk,54 990,В наличии
Диван Милкен Velvet Red,45 990,В наличии
Диван Клаймар Velvet Grey,57 990,В наличии
Диван Бруквиль Velvet Terra,49 990,В наличии
Диван Роттердам-3 Velvet Violet,31 990,В наличии
Диван угловой Вильен мини Velvet Eclipse,59 990,В наличии
Модульный диван Нолан-W 5 Soft Latte,198 440,В наличии
Диван Риард-2 Land Forest,38 990,В наличии
Диван Линс Velvet Pink,34 990,В наличии
Диван Майнап Velvet Yellow,46 990,В наличии
Диван Саннес Velvet Terra,49 990,В наличии
Диван Инес Vertical Silver,39 990,В наличии
Диван Льери Мини Velvet Atlantic,64 990,В наличии
Диван Тут Рядом Космос Зеленый,109 990,В наличии
Кушетка Норфолк Velvet Navy Blue,25 990,В наличии
Диван Льери-1 Soft Navy Blue,59 990,В наличии
Диван Тилар Textile Beige,29 990,В наличии
Диван Самми Velvet Olive,34 990,В наличии
Кушетка Мона Velvet Beige,32 990,В наличии
Диван угловой Плэнтис Velvet Terra,98 990,В наличии
Модульный диван Нолан-B 1 Soft Night,81 980,В наличии
Диван угловой Ситено Barhat Stone,69 990,В наличии
Кушетка Интори Soft Silver,28 990,В наличии
Диван угловой Спейс-1 Soft Grey,69 990,В наличии
Диван Рон Textile Grey,54 990,В наличии
Модульный диван Этен 3 Vertical Milk,140 940,В наличии
Диван Массе Bucle White,69 990,В наличии
Диван Динс Velvet Emerald,54 990,В наличии
Диван угловой Эдвин Velvet Light,69 990,В наличии
Диван Тут Рядом Космос Серый,109 990,В наличии
Диван Маре Мини Velvet Beige,27 990,В наличии
Диван угловой Дарол Velvet Silver,64 990,В наличии
Диван Виена Velvet Blue,64 990,В наличии
Диван Коренс-3 Bucle Green,46 990,В наличии
Диван угловой Стаус Velvet Smoke,42 990,В наличии
Диван угловой Ройн Мини Velvet Beige,42 990,В наличии
Диван угловой Беллер Textile Grafit,39 990,В наличии
Диван Ольен Velvet Navy Blue,64 990,В наличии
Диван угловой Сайле Barhat Ginger,139 990,В наличии
Диван угловой Беллер Textile Ocean,39 990,В наличии
Диван Динс Мини Velvet Red,49 990,В наличии
Диван угловой Аллаум Linia Navy Blue,52 990,В наличии
Диван Клаймар Velvet Terra,57 990,В наличии
Модульный диван Brera-4 Velour Cinnamon,161 970,В наличии
Модульный диван Этен Vertical Jeans,81 960,В наличии
Диван Боско-2 Land Terra,39 990,В наличии
Диван Гарди Soft Grey,34 990,В наличии
Диван Brera Bucle Beige,119 990,В наличии
Диван Клаймар Velvet Stone,57 990,В наличии
Диван Лофт Linia Ginger,45 990,В наличии
Диван Эрвин-3 White,38 990,В наличии
Модульный диван Полан-1 Velvet Light,73 970,В наличии
Модульный диван Полан-3 Velvet Terra,70 960,В наличии
Диван Рейли Velvet Yellow,34 990,В наличии
Диван Рон Textile Beige,54 990,В наличии
Диван угловой Стаус Velvet Olive,42 990,В наличии
Модульный диван Риббл-1 Bucle Eclipce,76 980,В наличии
Диван Риббл-10 Bucle Mint,83 990,В наличии
Диван Сторм Land Grey,54 990,В наличии
Диван Массе Velvet Mint,59 990,В наличии
Диван Лофт Linia Silver,45 990,В наличии
Модульный диван Нолан-W 1 Soft Grafit,81 980,В наличии
Диван угловой Харинг Soft Night,92 990,В наличии
Диван Данста Textile Honey,79 990,В наличии
Диван Нумо Мини Textile Yellow,24 990,В наличии
Диван Картос Velvet Terra,52 990,В наличии
Диван Гарди Soft Milk,34 990,В наличии
Диван Арклоу Cozy Storm,52 990,В наличии
Диван угловой Динс Velvet Stone,59 990,В наличии
Диван угловой Нумо Velvet Green,47 990,В наличии
Диван Дара Velvet Emerald,44 990,В наличии
Диван угловой Вильен мини Velvet Terra,59 990,В наличии
Диван угловой Плэнтис Velvet Beige,98 990,В наличии
Диван угловой Мисл-1 Barhat Marsala,109 990,В наличии
Диван Коренс Bucle Green,38 990,В наличии
Диван Тут Рядом Дом Зеленый,72 990,В наличии
Кушетка Ринт Bucle Pink,20 990,В наличии
Модульный диван Риббл-3 Bucle Lilac,153 970,В наличии
Диван Боско-3 Land Blue,49 990,В наличии
Диван Пайпел Bucle Grafit,49 990,В наличии
Диван Гарди Soft Pink,34 990,В наличии
Кушетка Кото Cozy Ivory,46 990,В наличии
Диван Кускен Velvet Red,46 990,В наличии
Диван Нумо Мини Textile Navy Blue,24 990,В наличии
Диван Леймарк мини Barhat Blue,46 990,В наличии
Диван Мисл Barhat Rose,79 990,В наличии
Диван угловой Биани-2 Barhat Blue,98 990,В наличии
Диван Нумо Velvet Grafit,37 990,В наличии
Диван Пайпел Bucle Yellow,49 990,В наличии
Диван Риббл-2 Bucle Lilac,68 990,В наличии
Диван Мейлон Velvet Beige,47 990,В наличии
Кушетка Роби Textile Yellow,19 990,В наличии
Диван Кареро Bucle Mint,82 990,В наличии
Диван угловой Слипсон Velvet Emerald,66 990,В наличии
Модульный диван Полан-1 Velvet Terra,73 970,В наличии
Диван Риард-3 Land Black,46 990,В наличии
Диван угловой Амрано Velvet Emerald,42 990,В наличии
Модульный диван Нолан-W 1 Soft Jungle,81 980,В наличии
Модульный диван Brera-2 Velour Smoke,105 980,В наличии
Модульный диван Brera-6 Velour Cherry,171 960,В наличии
Модульный диван Этен 6 Vertical Jeans,82 960,В наличии
Диван Мона Velvet Beige,29 990,В наличии
Диван Коренс Happy Yellow,30 990,В наличии
Модульный диван Нолан-W 2 Soft Night,91 470,В наличии
Модульный диван Этен 4 Vertical Milk,203 920,В наличии
Диван Коренс-3 Bucle White,46 990,В наличии
Диван Майнап Velvet Light,46 990,В наличии
Диван Гарди Soft Jungle,34 990,В наличии
Диван Кускен Velvet Yellow,46 990,В наличии
Диван угловой Биани-1 Cozy Ivory,98 990,В наличии
Диван Мона Velvet Yellow,29 990,В наличии
Диван Лави Velvet Smoke,43 990,В наличии
Модульный диван Нолан-W 2 Soft Grafit,91 470,В наличии
Модульный диван Нолан-W 4 Soft Yellow,146 450,В наличии
Модульный диван Полан-1 Velvet Smoke,73 970,В наличии
Диван угловой Лаберт Barhat Forest,109 990,В наличии
Модульный диван Нолан-W 2 Soft Milk,91 470,В наличии
Диван Мира Velvet Yellow,43 990,В наличии
Кушетка Кото Cozy Emerald,46 990,В наличии
Диван угловой Льери Barhat Beige,98 990,В наличии
Диван Слипсон Velvet Milk,59 990,В наличии
Диван угловой Аллаум Linia Silver,52 990,В наличии
Диван Сторм Land Latte,54 990,В наличии
Модульный диван Полан-5 Velvet Light,127 950,В наличии
Диван Леймарк мини Barhat Terra,46 990,В наличии
Диван угловой Дарол Velvet Emerald,64 990,В наличии
Кушетка Берил Velvet Ocean,35 990,В наличии
Диван Мисл Barhat Stone,74 990,В наличии
Диван Риен Velvet Beige,49 990,В наличии
Диван угловой Дарол Velvet Navy Blue,64 990,В наличии
Диван Льери Barhat Silver,79 990,В наличии
Диван Риббл-6 Bucle Mint,51 990,В наличии
Кушетка Венето Velvet Poudre,38 990,В наличии
Диван Лейсон Velvet Mint,49 990,В наличии
Диван Динс Velvet Navy Blue,54 990,В наличии
Диван угловой Порту Textile Yellow,32 990,В наличии
Диван Рейли Velvet Grey,34 990,В наличии
Диван угловой Ройн Мини Velvet Terra,42 990,В наличии
Диван Роттердам Velvet Yellow,25 990,В наличии
Диван угловой Аронт Мини Velvet Grey,58 990,В наличии
Диван угловой Бруквиль Velvet Grey,59 990,В наличии
Диван Кела Мини Velvet Beige,39 990,В наличии
Диван Ольен Мини Velvet Sand,54 990,В наличии
Диван угловой Шера Velvet Light,102 990,В наличии
Диван Нумо Velvet Light,37 990,В наличии
Диван угловой Маркфул Velvet Light,79 990,В наличии
Модульный диван Полан-5 Velvet Moss,127 950,В наличии
Диван Сите-3 Velvet Coral,39 990,В наличии
Диван Кускен Velvet Sand,46 990,В наличии
Диван Боско-2 Land Blue,39 990,В наличии
Диван Кинси-3 Land Grafit,56 990,В наличии
Диван Ольен Velvet Yellow,64 990,В наличии
Кушетка Интори Soft Jungle,28 990,В наличии
Диван Бруквиль Velvet Blue,49 990,В наличии
Диван угловой Виена Bucle Green,94 990,В наличии
Диван Спейс-2 Velvet Blue,89 990,В наличии
Модульный диван Нолан-B 3 Soft Grafit,114 970,В наличии
Модульный диван Brera-3 Velour Cinnamon,113 970,В наличии
Диван угловой Нумо Velvet Yellow,47 990,В наличии
Диван Мира Velvet Grey,43 990,В наличии
Диван Леймарк Velvet Beige,49 990,В наличии
Модульный диван Этен 2 Vertical Milk,149 940,В наличии
Диван Пайпел Bucle Forest,49 990,В наличии
Диван угловой Порту Textile Grafit,32 990,В наличии
Диван угловой Виена Velvet Light,69 990,В наличии
Модульный диван Brera-1 Bucle Beige,256 950,В наличии
Диван Коренс Bucle White,38 990,В наличии
Диван Ларонсо Soft Pearl,84 990,В наличии
Диван Види Textile Light,25 990,В наличии
Диван Лонди Bucle Marble,52 990,В наличии
Кушетка Манс Velvet Grey,32 990,В наличии
Диван угловой Майнап Velvet Grafit,49 990,В наличии
Диван Шилдс Textile Ginger,86 990,В наличии
Диван Шилдс Bucle Marble,79 990,В наличии
Диван Роттердам Velvet Blue,25 990,В наличии
Кушетка Оренте Soft Latte,46 990,В наличии
Диван Риард-3 Land Marsala,46 990,В наличии
Модульный диван Риббл-3 Bucle Forest,153 970,В наличии
Модульный диван Нолан-B 5 Soft Milk,198 440,В наличии
Диван угловой Эби-1 Happy Light,72 990,В наличии
Модульное кресло Полан Velvet Moss,43 970,В наличии
Модульный диван Brera-5 Velour Galaxy,120 980,В наличии
Модульный диван Нолан-B 4 Soft Night,146 450,В наличии
Модульный диван Brera-5 Velour Mix,120 980,В наличии
Диван угловой Виллес Velvet Beige,56 990,В наличии
Диван Порту Textile Grafit,25 990,В наличии
Диван Сорен Textile Grey,59 990,В наличии
Модульный диван Риббл-3 Bucle Silver,153 970,В наличии
Диван угловой Вайвел Barhat Ginger,89 990,В наличии
Диван Льери Мини Velvet Light,64 990,В наличии
Диван Види Textile Navy Blue,25 990,В наличии
Диван Бруквиль Velvet Smoke,49 990,В наличии
Модульный диван Этен Vertical Terra,81 960,В наличии
Диван Стаус Velvet Stone,30 990,В наличии
Модульный диван Brera-7 Velour Stone,177 970,В наличии
Диван Слипсон Мини Linia Beige,44 990,В наличии
Диван Нумо Мини Textile Sky,24 990,В наличии
Кушетка Кото Cozy Beige,46 990,В наличии
Диван Милкен Vertical Jeans,45 990,В наличии
Диван Тут Рядом Дом Сине-бежевый,72 990,В наличии
Кушетка Тут Рядом Космос Графитовый,89 990,В наличии
Диван Саннес Velvet Olive,49 990,В наличии
Диван Виенсо Bucle Ginger,79 990,В наличии
Диван Лилле Velvet Grey,49 990,В наличии
Диван Лилле Velvet Stone,49 990,В наличии
Диван угловой Вильен мини Velvet Olive,59 990,В наличии
Модульный диван Риббл-1 Bucle Forest,76 980,В наличии
Диван угловой Сайле Barhat Navy Blue,139 990,В наличии
Диван Сорен Textile Navy Blue,59 990,В наличии
Диван Ниса Land Marsala,44 990,В наличии
Модульное кресло Полан Velvet Light,43 970,В наличии
Диван Пайпел-3 Bucle Beige,54 990,В наличии
Диван Дара Velvet Yellow,44 990,В наличии
Модульный диван Этен 6 Vertical Light,82 960,В наличии
Диван Сваут Velvet Grey,66 990,В наличии
Кушетка Норфолк Velvet Pink,25 990,В наличии
Диван угловой Биани-2 Barhat Latte,98 990,В наличии
Диван Марей Soft Ginger,89 990,В наличии
Диван Эби Мини Linia Silver,56 990,В наличии
Диван Эрвин-2 Grey,30 990,В наличии
Модульный диван Brera-6 Bucle Beige,222 960,В наличии
Кушетка Норфолк Velvet Light,25 990,В наличии
Диван Эби Мини Linia Mint,56 990,В наличии
Диван Риббл-6 Bucle Forest,51 990,В наличии
Диван Кела Мини Velvet Silver,39 990,В наличии
Диван Эби Velvet Coral,64 990,В наличии
Диван угловой Ситено Barhat Light,69 990,В наличии
Диван Винси Soft Navy Blue,22 990,В наличии
Модульный диван Риббл-2 Bucle Silver,128 980,В наличии
Диван Клаймар Velvet Blue,57 990,В наличии
Диван Шилдс Textile Night,86 990,В наличии
Диван Стаус Velvet Grey,30 990,В наличии
Диван Картос Velvet Yellow,52 990,В наличии
Модульный диван Риббл-2 Bucle Eclipce,128 980,В наличии
Диван Риббл-11 Bucle Lilac,83 990,В наличии
Диван Дара Velvet Milk,44 990,В наличии
Диван Рейли Velvet Light,34 990,В наличии
Кушетка Берил Velvet Olive,35 990,В наличии
Диван Кинси-3 Land Black,56 990,В наличии
Диван угловой Эдвин Velvet Grey,69 990,В наличии
Диван Спейс Soft Navy Blue,64 990,В наличии
Диван Гарди Soft Terra,34 990,В наличии
Диван Лофт Linia Yellow,45 990,В наличии
Кушетка Олтен Textile Grafit,32 990,В наличии
Модульный диван Нолан-W 5 Soft Grafit,198 440,В наличии
Диван Рон Textile Yellow,54 990,В наличии
Диван Сторм Land Yellow,54 990,В наличии
Диван угловой Маркфул Velvet Grey,79 990,В наличии
Диван Сорен Textile Beige,59 990,В наличии
Диван Леймарк мини Barhat Olive,46 990,В наличии
Диван Лесли Velvet Sand,46 990,В наличии
Кушетка Оренте Soft Mint,46 990,В наличии
Диван Винси Soft Olive,22 990,В наличии
Диван Риард-2 Land Marsala,38 990,В наличии
Модульный диван Сэндж 3 Textile Sky,78 960,В наличии
Диван Кейсес Velvet Yellow,26 990,В наличии
Кушетка Дилси Textile Grafit,37 990,В наличии
Диван Данста Textile Gold,79 990,В наличии
Модульный диван Нолан-W 3 Soft Grey,114 970,В наличии
Кушетка Норфолк Velvet Grafit,25 990,В наличии
Модульный диван Нолан-B 3 Soft Grey,114 970,В наличии
Диван угловой Ларонсо Soft Blue,109 990,В наличии
Диван Риард-2 Land Stone,38 990,В наличии
Диван угловой Вильен мини Velvet Caramel,59 990,В наличии
Модульный диван Нолан-W 5 Soft Milk,198 440,В наличии
Диван Ларонсо Bucle Shadow,89 990,В наличии
Диван угловой Льери Мини Velvet Yellow,69 990,В наличии
Диван Порту Мини Textile Grafit,26 990,В наличии
Диван Льери Мини Velvet Yellow,64 990,В наличии
Диван угловой Виллес Velvet Olive,56 990,В наличии
Диван Кинси-2 Land Marsala,49 990,В наличии
Диван угловой Бонент Velvet Grey,92 990,В наличии
Диван угловой Лилле Velvet Light,59 990,В наличии
Модульный диван Полан-3 Velvet Ocean,70 960,В наличии
Диван Динс Мини Velvet Yellow,49 990,В наличии
Кушетка Олтен Textile Forest,32 990,В наличии
Диван Льери-1 Soft Grey,59 990,В наличии
Диван Стаус Мини Textile Silver,24 990,В наличии
Диван Бонс-Т Velvet Emerald,44 990,В наличии
Модульный диван Brera-8 Velour Mix,123 970,В наличии
Диван угловой Дисент-2 Soft Light,139 990,В наличии
Диван Льери-1 Soft Latte,59 990,В наличии
Диван Леймарк мини Barhat Smoke,46 990,В наличии
Диван Ольен Мини Velvet Silver,54 990,В наличии
Диван Сваут Velvet Beige,66 990,В наличии
Диван угловой Слипсон Happy Yellow,66 990,В наличии
Диван Данста Velvet Smoke,66 990,В наличии
Диван угловой Бонент Velvet Moss,92 990,В наличии
Диван Порту Мини Textile Beige,26 990,В наличии
Модульный диван Сэндж 2 Textile Light,58 970,В наличии
Диван Риббл-6 Bucle Grafit,51 990,В наличии
Диван Дисент Velvet Stone,79 990,В наличии
