name,price
Диван Рейли Velvet Mint,34 990
Диван Мона Velvet Coral,29 990
Диван Викс Textile Grafit,21 990
Диван Нумо Velvet Grey,37 990
Диван Хевит Velvet Eclipse,39 990
Диван Лачи Velvet Silver,32 990
Диван Риен Velvet Smoke,49 990
Диван угловой Эдвин Velvet Moss,69 990
Модульный диван Сэндж 3 Textile Light,78 960
Диван Види Textile Ocean,25 990
Диван Риббл-6 Bucle Lilac,51 990
Диван Стаус Velvet Olive,30 990
Диван Лави Velvet Yellow,43 990
Диван Дисент Soft Ginger,98 990
Диван Байма Velvet Beige,69 990
Диван Терм Velvet Smoke,69 990
Диван Виенсо Bucle Sand,79 990
Кушетка Венето Velvet Terra,38 990
Диван угловой Биани-1 Barhat Olive,79 990
Диван Лачи Velvet Yellow,32 990
Модульный диван Brera-4 Bucle Beige,206 970
Диван угловой Мейлон Velvet Terra,49 990
Диван Арклоу Soft Silver,56 990
Диван угловой Майнап Velvet Navy Blue,49 990
Модульный диван Нолан-B 4 Soft Yellow,146 450
Диван Стаус Velvet Blue,30 990
Диван Нумо Мини Textile Light,24 990
Диван Порту Textile Brown,25 990
Диван Кела Мини Velvet Grafit,39 990
Диван Роттердам Velvet Olive,25 990
Диван Данста Textile Night,79 990
Диван Боско-3 Land Yellow,49 990
Диван Нумо Velvet Latte,37 990
Диван угловой Ларонсо Soft Pearl,109 990
Диван Сваут Velvet Mustard,66 990
Диван Данста Velvet Light,66 990
Кушетка Интори Soft Night,28 990
Диван Роттердам-3 Velvet Blue,31 990
Диван Маре Мини Velvet Pink,27 990
Диван угловой Онте Bucle Silver,109 990
Диван угловой Амрано Velvet Stone,42 990
Диван Сите-2 Barhat Beige,32 990
Модульный диван Нолан-W 4 Soft Jungle,146 450
Диван Самми Velvet Midnight,34 990
Диван Самми Velvet Coral,34 990
Диван Биани Bucle Beige,89 990
Диван Арклоу Cozy Ivory,52 990
Модульный диван Brera-7 Velour Mix,177 970
Диван Саннес Velvet Silver,49 990
Диван угловой Динс Velvet Navy Blue,59 990
Диван Лофт Linia Nut,45 990
Диван Кускен Vertiсal Lavender,46 990
Модульный диван Нолан-B 5 Soft Jungle,198 440
Диван угловой Шера Velvet Blue,102 990
Модульный диван Риббл-3 Bucle Mint,153 970
Диван Льери Мини Velvet Grey,64 990
Кушетка Мона Velvet Olive,32 990
Диван Самми Velvet Plum,34 990
Диван Самми Velvet Beige,34 990
Диван Тут Рядом Космос Бежевый,109 990
Кушетка Роби Textile Coral,19 990
Диван Байма Velvet Milk,69 990
Кушетка Роби Textile Light,19 990
Диван Маре Мини Velvet Silver,27 990
Диван Риббл-11 Bucle Mint,83 990
Диван Ситено Barhat Blue,59 990
Диван Динс Мини Velvet Latte,49 990
Диван угловой Виена Velvet Olive,69 990
Диван угловой Эби-2 Velvet Coral,98 990
Диван угловой Маркфул Velvet Emerald,79 990
Модульный диван Нолан-B 1 Soft Grey,81 980
Модульный диван Brera-7 Bucle Beige,216 970
Диван Мира Velvet Navy Blue,43 990
Модульный диван Полан-5 Velvet Ocean,127 950
Кушетка Ринт Bucle Yellow,20 990
Модульный диван Нолан-W 5 Soft Night,198 440
Кушетка Оренте Soft Blue,46 990
Диван Хевит Velvet Olive,39 990
Диван Коренс-3 Happy Grey,35 990
Диван Коренс-3 Happy Yellow,35 990
Модульный диван Brera-3 Velour Plum,113 970
Диван угловой Ларонсо Soft Latte,109 990
Диван Мейлон Velvet Eclipse,47 990
Модульный диван Полан-2 Cozy Ivory,114 960
Модульный диван Brera-3 Velour Forest,113 970
Диван угловой Лаберт Barhat Latte,109 990
Диван угловой Виллес Velvet Stone,56 990
Диван Виена Bucle Silver,89 990
Диван Сите-3 Velvet Moss,39 990
Модульное кресло Полан Velvet Caramel,45 970
Диван угловой Мейлон Velvet Eclipse,49 990
Диван Картос Velvet Beige,52 990
Модульный диван Brera-4 Velour Plum,161 970
Модульный диван Этен 3 Vertical Jeans,140 940
Диван угловой Бонент Velvet Smoke,92 990
Диван Нумо Мини Textile Grafit,24 990
Диван Порту Textile Ocean,25 990
Диван угловой Дисент-1 Soft Toffe,96 990
Диван Спейс-2 Velvet Grey,89 990
Диван Кареро Bucle Silver,82 990
Модульный диван Риббл-1 Bucle Mint,76 980
Модульный диван Риббл-4 Bucle Forest,153 970
Диван угловой Слипсон Velvet Silver,66 990
Диван угловой Лаберт Barhat Smoke,109 990
Модульный диван Полан-2 Velvet Caramel,95 960
Диван угловой Лаберт Barhat Olive,109 990
Диван угловой Нумо Velvet Grafit,47 990
Диван угловой Сайле Barhat Silver,139 990
Кушетка Норфолк Velvet Silver,25 990
Диван Лонди Bucle Smoky,52 990
Модульный диван Нолан-B 3 Soft Yellow,114 970
Диван Ситено Barhat Stone,59 990
Диван Эби Мини Linia Navy,56 990
Диван угловой Шера Velvet Smoke,102 990
Модульный диван Brera-2 Velour Lilac,105 980
Диван Талас Velvet Stone,39 990
Диван Лофт Linia Olive,45 990
Диван Мейлон Velvet Smoke,47 990
Модульный диван Этен 5 Vertical Jeans,77 960
Диван Мисл Barhat Marsala,74 990
Диван угловой Аллаум Linia Stone,52 990
Модульный диван Риббл-1 Bucle Grafit,76 980
Диван Спейс-2 Velvet Beige,89 990
Модульный диван Нолан-B 2 Soft Grafit,91 470
Модульный диван Brera-2 Velour Caramel,105 980
Кушетка Тут Рядом Космос Серый,89 990
Диван угловой Динс Velvet Yellow,59 990
Диван угловой Вайвел Barhat Smoke,89 990
Диван Бонс-Т Velvet Mint,44 990
Диван Викс Textile Sky,21 990
Модульный диван Нолан-B 4 Soft Grey,146 450
Диван Риббл-11 Bucle Eclipce,83 990
Диван угловой Вильен мини Velvet Plum,59 990
Диван Кареро Velvet Light,69 990
Кушетка Олтен Textile Blue,32 990
Модульный диван Нолан-B 1 Soft Yellow,81 980
Диван Боско-2 Land Yellow,39 990
Модульный диван Риббл-2 Bucle Lilac,128 980
Модульный диван Нолан-W 5 Soft Jungle,198 440
Диван угловой Биани-1 Barhat Blue,79 990
Диван Нумо Мини Textile Silver,24 990
Диван Пайпел-3 Bucle Forest,54 990
Диван угловой Майнап Velvet Latte,49 990
Диван Ольен Мини Velvet Latte,54 990
Диван Виенсо Bucle Cloud,79 990
Диван Маре Мини Velvet Yellow,27 990
Диван угловой Онте Bucle Mint,109 990
Диван Лофт Linia Navy Blue,45 990
Диван Милкен Velvet Yellow,45 990
Диван угловой Льери Barhat Blue,98 990
Диван Тут Рядом Космос Светло-Бежевый,109 990
Диван Ниса Land Forest,44 990
Диван Маркфул Velvet Blue,66 990
Модульный диван Риббл-5 Bucle Silver,194 960
Диван угловой Динс Velvet Emerald,59 990
Диван Сорен Textile Yellow,59 990
Диван Тут Рядом Дом Синий,72 990
Диван Марей Soft Grey,89 990
Диван Саннес Velvet Grey,49 990
Диван Динс Мини Velvet Silver,49 990
Диван Кинси-3 Land Navy Blue,56 990
Диван Brera Velour Galaxy,98 990
Диван угловой Майнап Velvet Grey,49 990
Диван угловой Лилле Velvet Terra,59 990
Диван Майнап Velvet Olive,46 990
Диван Тут Рядом Дом Серо-графитовый,72 990
Кушетка Дилси Textile Silver,37 990
Диван Майнап Velvet Grafit,46 990
Модульный диван Brera-8 Velour Black,123 970
Диван Риббл-7 Bucle Eclipce,51 990
Модульный диван Полан-2 Velvet Smoke,93 960
Модульный диван Сэндж 1 Textile Yellow,64 970
Модульный диван Нолан-W 3 Soft Grafit,114 970
Модульный диван Brera-2 Bucle Beige,133 980
Диван Хевит Velvet Terra,39 990
Модульный диван Риббл-5 Bucle Eclipce,194 960
Диван угловой Онте Textile Grey,129 990
Диван Порту Textile Light,25 990
Модульный диван Brera-8 Velour Stone,123 970
Диван Кейсес Velvet Grey,26 990
Диван Кела Мини Velvet Mint,39 990
Диван угловой Спейс-1 Velvet Grey,69 990
Диван угловой Эби-1 Velvet Blue,72 990
Диван Риббл-2 Bucle Mint,68 990
Модульный диван Brera-2 Velour Cherry,105 980
Диван Хевит Velvet Yellow,39 990
Диван Кейсес Velvet Navy Blue,26 990
Диван Виена Velvet Light,64 990
Диван Лесли Velvet Yellow,46 990
Диван Бонс-Т Velvet Yellow,44 990
Диван Тилар Textile Navy Blue,29 990
Диван угловой Амрано Velvet Blue,42 990
Диван Лави Velvet Eclipse,43 990
Диван угловой Эби-1 Velvet Coral,72 990
Диван Риен Velvet Terra,49 990
Диван Льери Мини Velvet Coral,64 990
Диван угловой Дисент-2 Soft Silver,139 990
Диван угловой Дисент-2 Velvet Smoke,109 990
Диван Лесли Velvet Red,46 990
Диван угловой Харинг Soft Terra,92 990
Диван Роттердам-3 Velvet Olive,31 990
Модульный диван Нолан-W 3 Soft Yellow,114 970
Диван угловой Вайвел Barhat Beige,89 990
Диван Милкен Vertical Lavender,45 990
Диван Ларонсо Soft Blue,84 990
Модульный диван Нолан-W 2 Soft Grey,91 470
Модульный диван Brera-1 Velour Cinnamon,202 950
Диван угловой Шера Velvet Stone,102 990
Диван Лачи Velvet Pink,32 990
Модульный диван Нолан-B 2 Soft Latte,91 470
Модульный диван Риббл-2 Bucle Grafit,128 980
Диван Маркфул Velvet Emerald,66 990
Модульный диван Риббл-2 Bucle Forest,128 980
Диван Brera Velour Cherry,98 990
Диван Эрвин-2 Light,30 990
Диван угловой Ройн Мини Velvet Smoke,42 990
Модульный диван Полан-4 Velvet Ocean,100 960
Диван Brera Velour Caramel,98 990
Диван Хевит Velvet Beige,39 990
Диван Талас Velvet Beige,39 990
Диван Роттердам Velvet Beige,25 990
Диван Винси Textile Ginger,24 990
Диван Слипсон Мини Linia Yellow,44 990
Диван Терм Zamsha Olive,89 990
Модульный диван Нолан-W 3 Soft Night,114 970
Модульный диван Brera-8 Velour Olive,123 970
Диван Эрвин-2 Black,30 990
Диван Инес Vertical Blue,39 990
Диван угловой Льери Barhat Silver,98 990
Модульный диван Brera-8 Velour Caramel,123 970
Диван угловой Плэнтис Velvet Smoke,98 990
Диван Риард-3 Land Light,46 990
Модульный диван Нолан-B 4 Soft Grafit,146 450
Диван Порту Textile Silver,25 990
Диван угловой Мисл-1 Barhat Mint,109 990
Диван угловой Слипсон Velvet Stone,66 990
Диван Риббл-10 Bucle Grafit,83 990
Диван Сорен Textile Plum,59 990
Диван угловой Ситено Barhat Blue,69 990
Модульный диван Риббл-4 Bucle Eclipce,153 970
Диван угловой Биани-2 Barhat Night,98 990
Диван Рон Textile Plum,54 990
Диван Бонент Velvet Plum,76 990
Диван Рейли Velvet Coral,34 990
Диван Риард-3 Land Stone,46 990
Модульный диван Brera-8 Bucle Beige,156 970
Диван Картос Velvet Mint,52 990
Диван угловой Эдвин Velvet Smoke,69 990
Модульный диван Нолан-W 2 Soft Jungle,91 470
Диван Мона Velvet Grey,29 990
Диван Кареро Bucle Smoky,82 990
Диван Эрвин-2 Red,30 990
Диван Пайпел Bucle Beige,49 990
Диван Ольен Мини Cozy Ivory,64 990
Модульный диван Сэндж 2 Textile Grey,58 970
Модульный диван Нолан-B 2 Soft Jungle,91 470
Модульный диван Сэндж 3 Textile Ocean,78 960
Диван Лави Velvet Pink,43 990
Диван Боско-3 Land Forest,49 990
Диван Стаус Мини Textile Coral,24 990
Модульный диван Сэндж 2 Textile Sky,58 970
Диван Спейс-2 Velvet Olive,89 990
Модульный диван Риббл-3 Bucle Eclipce,153 970
Диван Мейлон Velvet Yellow,47 990
Кушетка Манс Velvet Mint,32 990
Диван Мира Velvet Olive,43 990
Модульный диван Этен Vertical Milk,81 960
Диван Лави Velvet Moss,43 990
Диван угловой Эби-2 Velvet Olive,98 990
Диван Спейс Velvet Terra,64 990
Диван угловой Виена Velvet Eclipse,69 990
Диван угловой Шера Velvet Terra,102 990
Диван Риард-2 Land Light,38 990
Диван Леймарк Velvet Wet Sand,49 990
Диван Риард-2 Land Black,38 990
Диван Види Textile Yellow,25 990
Диван Гарди Soft Night,34 990
Диван Ситено Barhat Light,59 990
Кушетка Дилси Textile Yellow,37 990
Диван Картос Velvet Olive,52 990
Диван Маркфул Velvet Light,66 990
Диван Ларонсо Textile Grafit,89 990
Диван Сваут Velvet Terra,66 990
Диван угловой Лаберт Barhat Beige,109 990
Диван угловой Дисент-1 Soft Jungle,96 990
Модульный диван Нолан-W 3 Soft Latte,114 970
Диван Инес Vertical Light,39 990
Кушетка Тут Рядом Космос Синий,89 990
Диван Ситено Barhat Ginger,59 990
Диван Саннес Velvet Mint,49 990
Диван Риббл-7 Bucle Forest,51 990
Диван угловой Бруквиль Velvet Terra,59 990
Диван угловой Лаберт Barhat Grafit,109 990
Диван угловой Нордика мини Velvet Light,59 990
Модульный диван Нолан-B 2 Soft Yellow,91 470
Модульный диван Риббл-5 Bucle Mint,194 960
Кушетка Норфолк Velvet Mint,25 990
Кушетка Берил Velvet Coral,35 990
Диван угловой Аллаум Linia Beige,52 990
Диван Роттердам Velvet Violet,25 990
Модульный диван Нолан-W 3 Soft Jungle,114 970
Диван Риббл-7 Bucle Mint,51 990
Диван Риард-3 Land Forest,46 990
Диван Риббл-1 Bucle Lilac,68 990
Диван Сваут Velvet Moss,66 990
Диван угловой Маркфул Velvet Coral,79 990
Диван угловой Бонент Velvet Light,92 990
Диван угловой Спейс-2 Velvet Olive,98 990
Диван угловой Мисл-1 Barhat Stone,109 990
Диван угловой Беллер Textile Navy Blue,43 990
Диван Кейсес Velvet Olive,26 990
Диван угловой Эби-2 Velvet Grey,98 990
Диван Коренс Happy Mint,30 990
Модульный диван Нолан-B 5 Soft Latte,198 440
Диван Риббл-1 Bucle Eclipce,68 990
Модульный диван Нолан-B 1 Soft Jungle,81 980
Диван Кинси-2 Land Navy Blue,49 990
Диван Ларонсо Soft Silver,84 990
Диван угловой Онте Bucle Eclipse,109 990
Диван угловой Вайвел Barhat Forest,89 990
Диван Маркфул Velvet Grey,66 990
Диван Мира Velvet Latte,43 990
Диван угловой Харинг Soft Jungle,92 990
Диван угловой Нумо Velvet Light,47 990
Диван угловой Мейлон Velvet Olive,49 990
Диван Роттердам-3 Velvet Silver,31 990
Диван Данста Velvet Mint,66 990
Модульный диван Этен 3 Vertical Terra,140 940
Диван Рейли Velvet Silver,34 990
Диван Динс Velvet Silver,54 990
Диван Тилар Cozy Milk,29 990
Диван Стаус Мини Textile Light,24 990
Диван угловой Ситено Barhat Mint,69 990
Модульный диван Нолан-W 3 Soft Milk,114 970
Модульный диван Полан-4 Velvet Light,100 960
Диван Арклоу Soft Blue,56 990
Диван Лачи Velvet Navy Blue,32 990
Диван угловой Биани-2 Barhat Beige,98 990
Диван Лейсон Velvet Yellow,49 990
Диван угловой Дисент-2 Soft Ginger,139 990
Диван Терм Velvet Beige,69 990
Модульный диван Этен 5 Vertical Terra,77 960
Диван угловой Динс Velvet Milk,59 990
Диван Нумо Velvet Pink,37 990
Диван Рон Textile Ocean,54 990
Диван угловой Лилле Velvet Atlantic,59 990
Диван угловой Эдвин Velvet Stone,69 990
Диван Мейлон Velvet Stone,47 990
Диван Линс Velvet Yellow,34 990
Диван Бонент Velvet Grey,76 990
Модульный диван Риббл-5 Bucle Grafit,194 960
Диван угловой Вайвел Barhat Night,89 990
Диван Хевит Velvet Smoke,39 990
Модульный диван Нолан-B 1 Soft Latte,81 980
Кушетка Ринт Bucle Forest,20 990
Диван Эби Мини Linia Stone,56 990
Модульный диван Нолан-W 1 Soft Yellow,81 980
Модульный диван Brera-4 Velour Beige,161 970
Диван угловой Льери Мини Velvet Emerald,69 990
Диван угловой Ройн Мини Velvet Pink,42 990
Модульный диван Brera-7 Velour Forest,177 970
Диван Кела Мини Velvet Navy Blue,39 990
Диван Маркфул Velvet Ocean,66 990
Диван угловой Порту Textile Brown,32 990
Диван угловой Бруквиль Velvet Blue,59 990
Диван Аркет-2 Velvet Smoke,34 990
Диван угловой Ситено Barhat Ginger,69 990
Диван угловой Биани-2 Cozy Ivory,119 990
Кушетка Тут Рядом Космос Зеленый,89 990
Диван Маре Мини Velvet Grafit,27 990
Диван Роттердам-3 Cozy Milk,34 990
Диван Соланс Velvet Sand,29 990
Диван угловой Бонент Velvet Terra,92 990
Диван Тилар Textile Yellow,29 990
Диван Викс Textile Yellow,21 990
Диван Эби Velvet Smoke,64 990
Диван угловой Биани-1 Barhat Night,79 990
Диван Кинси-2 Land Light,49 990
Диван угловой Шера Velvet Grey,102 990
Диван Лейсон Velvet Blue,49 990
Модульный диван Этен 1 Vertical Milk,115 950
Диван Нумо Velvet Green,37 990
Диван Дара Velvet Latte,44 990
Диван Марей Soft Latte,89 990
Диван Эрвин-2 White,30 990
Модульный диван Сэндж 1 Textile Grey,64 970
Диван Соланс Velvet Blue,29 990
Диван угловой Харинг Soft Toffe,92 990
Диван Лонди Cozy Ginger,52 990
Кушетка Дилси Textile Light,37 990
Диван угловой Виллес Velvet Smoke,56 990
Диван Бонент Velvet Moss,76 990
Диван угловой Сайле Barhat Stone,139 990
Диван Тут Рядом Космос Графитовый,109 990
Диван Гарди Soft Toffe,34 990
Диван угловой Аронт Мини Velvet Pink,58 990
Диван Риббл-2 Bucle Grafit,68 990
Модульный диван Сэндж 3 Textile Yellow,78 960
Модульный диван Нолан-B 5 Soft Yellow,198 440
Кушетка Интори Soft Yellow,28 990
Диван Риббл-1 Bucle Grafit,68 990
Диван угловой Эби-2 Velvet Smoke,98 990
Диван угловой Ларонсо Soft Terra,109 990
Диван Слипсон Мини Linia Stone,44 990
Диван Роттердам Velvet Silver,25 990
Диван Майнап Velvet Latte,46 990
Диван Виена Velvet Corall,64 990
Кушетка Кото Cozy Dove,46 990
Диван Сваут Velvet Emerald,66 990
Диван Линс Velvet Latte,34 990
Диван угловой Аронт Мини Velvet Smoke,58 990
Модульный диван Нолан-W 4 Soft Grafit,146 450
Модульный диван Нолан-B 3 Soft Night,114 970
Диван угловой Вайвел Barhat Caramel,89 990
Диван Биани Cozy Ivory,89 990
Модульный диван Полан-2 Velvet Terra,93 960
Диван угловой Аронт Мини Velvet Olive,58 990
Модульный диван Риббл-1 Bucle Silver,76 980
Диван Тут Рядом Дом Желтый,72 990
Диван Сите-2 Velvet Smoke,32 990
Модульный диван Этен 6 Vertical Mint,82 960
Кушетка Венето Velvet Green,38 990
Диван Эби Velvet Grey,64 990
Диван Ситено Barhat Emerald,59 990
Диван Талас Velvet Smoke,39 990
Диван угловой Дисент-1 Soft Grey,96 990
Диван Риббл-2 Bucle Forest,68 990
Диван Стаус Velvet Caramel,30 990
Диван Инес Vertical Grey,39 990
Модульный диван Полан-2 Velvet Ocean,93 960
Диван Лонди Cozy Ivory,52 990
Диван Линс Velvet Emerald,34 990
Модульный диван Этен 2 Vertical Jeance,149 940
Модульный диван Полан-3 Velvet Caramel,72 960
Диван Эрвин-3 Brown,38 990
Диван Пайпел-3 Bucle Grafit,54 990
Диван угловой Слипсон Velvet Milk,66 990
Диван угловой Льери Мини Velvet Coral,69 990
Диван Бонент Velvet Smoke,76 990
Диван Лонди Mima Pink,89 990
Модульный диван Полан-5 Velvet Smoke,127 950
Диван Сторм Land Milk,54 990
Диван Милкен Velvet Red,45 990
Диван угловой Вильен мини Velvet Eclipse,59 990
Диван угловой Майнап Velvet Yellow,49 990
Диван угловой Вильен мини Velvet Smoke,59 990
Кушетка Оренте Soft Yellow,46 990
Диван угловой Лаберт Barhat Blue,109 990
Диван угловой Сайле Barhat Light,139 990
Диван Лилле Velvet Light,49 990
Модульный диван Brera-1 Velour Caramel,202 950
Диван Эрвин-3 Red,38 990
Диван Клаймар Velvet Grey,57 990
Диван Бруквиль Velvet Terra,49 990
Диван Роттердам-3 Velvet Violet,31 990
Модульный диван Нолан-W 5 Soft Latte,198 440
Диван Риард-2 Land Forest,38 990
Диван Линс Velvet Pink,34 990
Диван Майнап Velvet Yellow,46 990
Диван Саннес Velvet Terra,49 990
Диван Инес Vertical Silver,39 990
Диван Льери Мини Velvet Atlantic,64 990
Диван Тут Рядом Космос Зеленый,109 990
Кушетка Норфолк Velvet Navy Blue,25 990
Диван Льери-1 Soft Navy Blue,59 990
Диван Тилар Textile Beige,29 990
Диван Самми Velvet Olive,34 990
Кушетка Мона Velvet Beige,32 990
Модульный диван Нолан-B 1 Soft Night,81 980
Диван угловой Ситено Barhat Stone,69 990
Кушетка Интори Soft Silver,28 990
Диван угловой Спейс-1 Soft Grey,69 990
Диван Рон Textile Grey,54 990
Модульный диван Этен 3 Vertical Milk,140 940
Диван Массе Bucle White,69 990
Диван Динс Velvet Emerald,54 990
Диван угловой Эдвин Velvet Light,69 990
Диван Тут Рядом Космос Серый,109 990
Диван Маре Мини Velvet Beige,27 990
Диван угловой Дарол Velvet Silver,64 990
Диван Виена Velvet Blue,64 990
Диван Коренс-3 Bucle Green,46 990
Диван угловой Стаус Velvet Smoke,42 990
Диван угловой Ройн Мини Velvet Beige,42 990
Диван угловой Беллер Textile Grafit,39 990
Диван Ольен Velvet Navy Blue,64 990
Диван угловой Сайле Barhat Ginger,139 990
Диван угловой Беллер Textile Ocean,39 990
Диван Динс Мини Velvet Red,49 990
Диван угловой Аллаум Linia Navy Blue,52 990
Диван Клаймар Velvet Terra,57 990
Модульный диван Brera-4 Velour Cinnamon,161 970
Модульный диван Этен Vertical Jeans,81 960
Диван Боско-2 Land Terra,39 990
Диван Гарди Soft Grey,34 990
Диван Brera Bucle Beige,119 990
Диван Клаймар Velvet Stone,57 990
Диван Лофт Linia Ginger,45 990
Диван Эрвин-3 White,38 990
Модульный диван Полан-1 Velvet Light,73 970
Модульный диван Полан-3 Velvet Terra,70 960
Диван Рейли Velvet Yellow,34 990
Диван Рон Textile Beige,54 990
Диван угловой Стаус Velvet Olive,42 990
Модульный диван Риббл-1 Bucle Eclipce,76 980
